Text,DocType
april dyncorp international di team patuxent river naval air station program travel ingalls field hot spring virginia test distribute aperture infrared countermeasure daircm system ah z mh aircraft objective detachment evaluate daircm improve missile countermeasure system determine system performance ready next phase test fielding addition di maintenance detachment team consist people navair atlantic test range center countermeasure among others ingalls field excellent airfield test little traffic tip top mountain terrain sharply drop valley east west challenge come test top mountain field elevation foot however weather april detachment weather varied degree fahrenheit sunny drive rain dense fog temp barely climb course day mh due full round torque check team battling heavy rain visibility foot although major maintenance complete aircraft prior detachment subsequent torque check every fastener driveshaft couple main transmission intermediate gearbox require cover lot bolt difficult access require di maintainer contort top sometimes inside aircraft maintenance like small task dry hangar back home patuxent river say charlie grogan dynaviation navy lead yet maintenance team execute flight line top mountain drive element rest detachment plan next flight event analyze data comfort hotel di team work full day drive rain dedication skill resolve team get job do return aircraft status test execution next day weather clear mh flew detachment team able successfully collect deliver need data bring capable system fleet magnitude work perform di maintenance personnel element attitude met task stand highlight time mountain say u navy lieutenant detachment,Public
navigate various permission license operate foreign country daunt dyncorp international afghanistan operation team group eleven employee support almost program afghanistan special support range across many different area include security personal security transport pst tax ministry foreign affair afghanistan mofa administration visa liaison support much work allows program afghanistan meet rule afghan law ensure law rule apply properly correctly team member interact various afghan ministry ensure visa mofa reference number deliver process time comprehensive tax situation dealt accurately correctly additionally team lead security director glen lewis ensures whenever incident timely accurate information disseminate across channel level dyncorp international one important challenge team face renew service international llc risk management company sil rmc license year without license letter bridging next license company longer provide rmc service customer short company can not conduct certain type business afghanistan mr zubair wahabzai visa government liaison specialist take difficult challenge even ministry interior counterterrorism department moict insistedit would willing give type bridging letter rmc company afghanistan multiple trip around city kabul include daily trip moict department meet senior leader constant engagement couple lot finesse result dyncorp international receive first highly sought bridging letter,Public
naval test wing pacific ntwp program point mugu california dyncorp international di employee wilfredo willie dumaop perform routine foreign object debris fod sweep bloodhound u navy air test evaluation squadron vx another routine fod sweep say willie di quality assurance qa representative notice something hidden behind pilot rudder pedal mr dumaop discover critical piece foreign debris stratus inverter power plug behind pedal without diligent effort attention detail piece equipment could easily foul vital safety flight control result significant damage even loss life say u navy vx maintenance officer mr dumaop found miss piece equipment even aircrew duty officer able communicate potential hard fod adrift cockpit even aircraft willie dumaop displayed exemplary commitment ideal safe effective maintenance foundation naval aviation continued maintenance officer action display example emulate achievement improve safety mr dumaop receive vx safety professional award im proud willie commitment safety attention detail would like congratulate deserve award say bob sanford point mugu assistant site manager qa director dis ntwp program di provide organizational level aircraft maintenance logistics support aircraft system subsystem aircrew system sar equipment support equipment se assign aircraft rotary fix lighter air unmanned aircraft site project test transient aircraft fm aircraft loaner aircraft training aircraft lease aircraft work perform navair point mugu locate naval base ventura county california support p c aircraft naval air weapon station naws china lake california support f g av sh aircraft,Public
last decade tragedy assistance program survivor tap receive million dollar support dyncorp international di employee corporate donation red shirt friday support troop campaign alone generate thousand dollar contribution di employee purchase red shirt wear support sacrifice serviceman woman throughout world dis journey hope charity golf tournament raise additional thousand sponsorship di supplier partner employee tap support many di family since di become first private company form official partnership tap provide support family fall di personnel agreement tap dis employee assistance program eap design support di employee family work together provide survivor di employee comfort care comprehensive service program include peer base emotional support case work assistance connection community base care grief trauma resource di lose eighty five teammate support u foreign policy objective watch bonnie carroll tap founder president thank people di brief two minute video tap tragedy assistance program survivor tap national organization provide compassionate care family america fall military hero member america arm force dy tap front line provide compassionate care family left behind since tap assist survive family member casualty officer caregiver grieve loss military love one regardless geography circumstance death,Public
dyncorp international di earn federal aviation administration faa diamond award excellence recognition commitment aviation maintenance training joint base andrew di team joint base andrew maryland earn prestigious award time program di provide service important person special air mission vipsam include aircraft maintenance munition base supply fuel support aircraft assign th wing th airlift wing award due entirely maintenance team dedication hard work say craig oneal andrew support division division manager theyve pull incredible year row diamond award high corporate award include individual corporate recognition award recognizes completion percent organization eligible maintenance technician specialized continuous training aircraft system regulation faa rule month period addition diamond award present company mechanic receives aviation maintenance technician award base number training hour log last time team compete award vipsam name since contract divide five separate program executive airlift rotary maintenance wing supply fuel munition transient alert year add craig team look forward continue truly amaze run earn prestigious award future executive airlift rotary maintenance wing service contract,Public
dyncorp international di team may fun play tournament mini golf green construct result july dynfun activity miniature golf course construction contest team work inventively build individual putt putt hole incorporate di wide virtual golf course spread throughout globe team logcaps ntc program fort irwin california built putt putt hole symbolize base desert include course feature representative many element location historical paint rock near main gate high mobility multi purpose wheel vehicle di maintains armored personnel carrier di also maintains uh blackhawk helicopter represent di air traffic controller orange cone represent vehicle issue yard rotational unit field maintenance area vehicle transfer di test repair inspection ammunition represent theatre ammunition supply point brake rotor exhaust pipe represent maintenance facility finally cactus donkey coyote represent desert account payable team fort worth texas go tropical luau party theme feature pool noodle guide tiki windmill metal filing rack tunnel pool float trap hibiscus flower ramp honor system scorecard emphasize fair play tournament prize alliance security facility fort worth texas set team dysfunctional hole feature edward snowden leonard moss start tee vintage cartoon burglar insider threat shadow man tube obstacle finish di mailroom mailbox mclean virginia office team corporate security facility real estate create carnival game type putt putt green three alternative score option ultimate goal score security superstar played di security open mini golf tournament result four way tie shootout conduct among winner dorian amstel result victorious security awareness medallion corporate human resource fort worth texas create green dyn mite prehistoric theme putt putt hole feature erupt volcano plastic bin water feature mini boulder velociraptor rex obstacle tropical pterodactyl whiteboard backdrop dry eraser artwork congratulation winner tie human resource alliance security facility team push creative limit stay within contest size guideline five terrific putt putt green design team receive prize innovative creation check mini golf flickr album di team play miniature golf hole,Public
washington technology release list large government contractor accord prime contract dollar year dyncorp international ranked th base prime contract washington technology top list washington technology list barometer federal market competitive landscape measure contractor accord prime contract area system integration professional service telecommunication high tech service area,Public
month employee dyncorp international di mclean virginia fort worth texas office collect dress shoe accessory donate uso metropolitan washington baltimore uso metro uso metro nonprofit organization charter congress dedicate serve serve family washington c maryland northern virginia help thousand devote volunteer uso metro provide program service active duty troop family area military hospital uso center uso airport lounge mobile uso branch service least one anniversary ball recognition gala year special event intimidate uncomfortable consider etiquette protocol associate attend function uso metro put full day event call project cinderella empowers woman interactive workshop beauty etiquette culminates woman choose selection donate item formal gown accessory program design help offset cost expensive military ball formal function total di collect dress pair shoe purse article jewelry,Public
dyncorp international di host student national defense university ndu mclean virginia office friday april student part national defense university competitive dwight eisenhower school national security resource strategy nearly year long curriculum prepares select military officer civilian leadership role success develop national security strategy graduate taught skill use well evaluate marshal manage resource execution military strategy many graduate program go hold leadership position throughout government become executive industry topic varied overview di specific program detail finance one area concentration dyncorp international ability stand high perform rapid response team offer unique tailor solution example question di approach complex task like respond natural disaster resource scarce need ever change group also interested learn di successfully implement large scale program quickly maintain high quality standard company core value seventeen scholar represent diverse group wide array experience include member u arm force select inter agency civilian representative tanzania croatia italy bosnia herzegovina arm force attendee hold rank military include commander lieutenant lieutenant colonel colonel group heard three presenter jim cassella svp business development janet oliver svp business development robert tillery svp operation look forward continue engage national defense university year come,Public
dyncorp international di fourth annual walk day challenge brought nearly double team last year top team trek win wednesday april day speed walk glory despite incoming afghanistan participant scrap time walk busy mission fill day di hold international walk day challenge remind employee importance take walk di walker texas virginia california alabama egypt india qatar afghanistan eagerly anticipate team result congratulation walk challenge winner unstoppables di business service bangalore india thank participant check dis walk day challenge flickr page look picture walker,Public
february dyncorp international rob tillery senior vice president operation join logcap team task order national training center fort irwin california presentation check national training center sergeant audie murphy club samc sergeant audie murphy club private u army organization enlist non commission officer dyncorp international chosen graciously sponsor induction ceremony new member national training center samc rob tillery program manager phil mead leadership sat local din facility enjoy meal present sponsorship check president samc sgjones left right garrison csm edward sg jones unk rob tillery msg wei sgm bowman left right sg jones rob tillery,Public
three service milestone reach recently na patuxent river maryland dyncorp international di program service aircraft u navy celebrate year service steve long walter muenzel celebrate year service ethrage duck haggard di service u navy pax river continuously since say randy hughes program manager steve walter duck played significant role dis continued success pax contribute long legacy provide unmatched dedicate service navy customer standout example serve today well tomorrow combine day service steve long begin career dynalectron dis predecessor company u naval test pilot school tps na patuxent river steve start maintain aircraft since work u nu b x aircraft steve currently subject matter expert nu b u aircraft influential training next generation aircraft mechanic support school unique national asset steve hold faa airframe power plant p license receive multiple letter appreciation work include one naval air test evaluation museum pax river another commander u naval test pilot school serve year tenure tps walter frank muenzel begin career dynalectron u navy tps aircraft mechanic serve four year united state marine corp usmc marine frank work f j aircraft reach rank corporal early frank transfer ground support equipment shop maintains many different type aviation support equipment tps naval air test evaluation museum pax river commend letter appreciation serve year tenure tps frank family history service nation born germany father station u air force brother retire usmc married wife evelyn year two daughter son ethrage duck haggard hold distinction long current continued service within company reach year milestone di service duck start employment contract field team aircraft mechanic march shaw afb south carolina perform aircraft maintenance service honolulu hawaii elmendorf alaska take position patuxent river many aircraft duck maintain pax river currently retire honorably displayed pax naval air museum currently serve business manager naval test wing atlantic program duck enjoys spending time grandson fishing hunt congratulation big thank behalf appreciative company say joe ford dynaviation president three gentleman reach epic extraordinary milestone year service,Public
clifford ruggles program manager dyncorp international di phoenix consult group recently travel afghanistan provide counter elicitation training dis afghanistan national army ana afghanistan national police anp afghanistan life support service ali program kabul former u army interrogator strategic debriefer phoenix consult group since mr ruggles focus training primarily teach technique recognize counter information gathering attempt potential competitor adversary anyone else seek gain insight dis operation due fact di employee afghanistan routinely work alongside competitor interact daily people dozen country potential unknowingly disseminate sensitive company information high say ruggles ali food service operation manager robert peter note thought class informative requirement contract especially overseas numerous opportunity employee inadvertently pas along proprietary information community people friendly one another one person may think friendly conversation another person may try use conversation elicit extract information company use proposal excellent class cliff ruggles excellent instructor tell long time show delivery presentation knowledge chart comment curtis blas ana anp director security operation although focus training event primarily counter elicitation phoenix consult group conduct wide variety training course asadvanced crisis negotiation business intelligence strategic debrief law enforcement source cognitive interview others add ruggles description phoenix course offering found online brochure information request training phoenix consult group program office contact phoenixconsulting dyn intl com,Public
october dyncorp international di sponsor national training center high desert chapter association united state army ausa rd annual golf tournament second year row along one large corporate sponsor di five four person team include first place team win team john pace technical inspector heavy wheel patrick pring welder heavy wheel rene moreno tactical vehicle mechanic hmmwv leo duarte maintenance supervisor track decide donate winning national training center sergeant audie murphy club samc follow donation samc inductee sr operation manager carl curtice along sr logistics manager jessie bates arrange di sponsor future samc inductee ceremony,Public
october dyncorp international di participate association united state army ausa annual meeting exposition large land power exposition professional development forum north america walter e washington convention center washington c attendee include senior defense department official military personnel industry executive participate event di one exhibitor invite attend learn company offering di executive maintain busy schedule networking fellow industry leader meeting customer gain knowledge army need throughout three day tradeshow george krivo dyncorp international chief executive officer personally host numerous senior level customer industry engagement met reporter defense one aviation week defense news share update di defense service industry interview address dis rebound new contract win defense budget readiness shortfall industry consolidation sale rumor george krivo also met bonnie carroll president founder tap present check recently raise di charity golf fundraiser texas september tap support many di survivor family di become first private company form official partnership tap provide support family fall di personnel photo ausa found flickr ausa ausa annual meeting exposition theme year ready today lethal tomorrow annual meeting help tell army story delivers key message worldwide audience exhibitor display innovative system product service give army incredible capability ausa since ausa work support national security advance interest america army men woman serve ausa private non profit educational organization support u army include active duty guard reserve civilian retiree family member,Public
dca live organization cover industry company people drive growth washington c region recognize dyncorp international di virginia robinson th annual dca live top corporate counsel event september partnership association corporate counsel national capital region dca live recognize interest dynamic house attorney washington c region virginia robinson chief counsel labor employment environmental health safety di attorney di legal department six year work di virginia hone skill top law firm country graduate penn state b english obtain law degree washington lee university school law brief interview dca live virginia discuss experience work house dyncorp international dca live summer vacation spot virginia italy venice padua florence rome dca live best part house virginia cultivate deeper understand client ability collaborate colleague client without billing pressure dca live big house trend issue law firm friend colleague know virginia important keep mind corporate client goal need stagnant change time sometimes quite quickly base wide variety constantly shift internal external pressure make sure ask client current issue face might influence handle otherwise seemingly unrelated matter dca live advice asoon graduate law school student virginia law firm job important way learn strong customer service skill start career private practice good idea keep eye house opportunity get senior career find work challenge reward,Public
april u embassy kabul recognize worldwide winner green council green diplomacy initiative gdi award recycle effort critical threat environment dyncorp international currently provide waste management service task order afghanistan life support service ali program lead recycle effort embassy annual gdi award recognize post office innovate reduce environmental footprint award present embassy kabul remain commit reduce environmental footprint despite face constant critical threat security environment limited infrastructure embassy recycle program recycle pound waste local partner turn recycle material item plastic furniture toilet paper dish partnership expands private sector lead economic growth provide employment alternative risk radicalization violent extremist message post also launch campaign discourage use bottle water emphasize compound water potable post green team ali program issue water bottle filter embassy personnel help reduce bottle water usage green diplomacy initiative green diplomacy initiative gdi launch april capture disseminate grassroots sustainability effort u department state gdi umbrella term action undertaken personnel post office bureau improve environmental performance sustainability department state world wide facility operation gdi support eco diplomacy unit within innovation directorate work strengthen disseminate tool policy aim increase operational efficiency reduce department environmental footprint operational cost department state chief sustainability officer cso provide strategic direction oversight effort gdi,Public
dyncorp international di recently nominate one small business partner da defense logistics u small business administration sba small business subcontractor year award da defense advance finalist washington c subcontractor recognize sba el paso district office small business subcontractor year th annual small business week award ceremony luncheon held el paso texas da defense solid small business partner di since say debbie newberry di small business senior manager support many dynlogistics contract first ft bliss texas wrm ii yorktown virginia eagle ft campbell kentucky t tacom multiple u location logcap fort irwin california di submit da defense nomination recently celebrate sba national small business week event recognize nation top small business entrepreneur april may da defense self lead organization provide truly seamless support every day say stephen blake eagle program manager prime contractor would proud team el paso small business week award ceremony attend dis debbie newberry afcap iv program manager timothy gahr addition el pasos small business subcontractor year award da defense president david granado present certificate special congressional recognition congressman beto orourke congratulate da defense say billy harlin di supply chain senior director deserve recognition small business subcontractor year,Public
dyncorp international di support afghanistan life support service ali program run waste management recycle program representative recently visit seven usaid location around afghanistan show program accomplish audience learn eye opening presentation u embassy kabul make effort reduce waste recycle plastic bottle aluminum can cardboard make household product locally di manages recycle initiative waste management subcontractor afghanistan recycle thousand pound plastic cardboard aluminum trash embassy sent recycle center worker sort separate recyclables plastic shred small fragment aluminum can compress dense bale cardboard press manageable size material sent vendor turn thing like mold plastic furniture toilet paper addition regular recycle di also partner another company dispose food waste generate kitchen operation e g preparation leftover etc along shred paper,Public
april dyncorp international di held annual international walk day challenge di team race take step designate nine hour period everyone push win di hold challenge remind employee importance take walk walker texas virginia california egypt afghanistan marshal island eagerly anticipate team result congratulation walk challenge winner ammo dawgs kandahar afghanistan thank participant check dis walk day challenge flickr page look picture walker,Public
april dyncorp international mclean virginia office host pack party local uso chapter put together snack pack troop pack troop opportunity group support service men woman team step task three assembly line colleague fill ziploc bag full snack item another area colleague pack bag box teamwork camaraderie make service project fun activity office view uso metro video explain program click photo dyncorp international pack party found flickr page,Public
