Text,DocType
dyncorp international participate several job fair related event august recruiter worldwide recruiting staff service llc wrss wholly own subsidiary dyncorp international hand follow event recruiter hand th annual nawlee national conference host austin police department take place august omni austin downtown hotel austin texas event annual training conference held summer attend woman local state federal international law enforcement agency around world national association woman law enforcement executive nawlee first organization establish address unique need woman hold senior management position law enforcement nawlee non profit organization sponsor administer directly law enforcement practitioner mission serve interest woman executive aspire executive law enforcement recruiter meet graduate u military academy west point u naval academy annapolis u air force academy colorado spring u coast guard academy new london u merchant marine academy king point service academy career conference sacc event held august manchester grand hyatt san diego calif sacc non profit organization administer support five service academy sacc job fair offer company chance meet one one hundred candidate allow company evaluate candidate skill set formal interview information dyncorp international job fair related event visit dis career page six decade qualify experienced professional dyncorp international provide customer top quality service around world people enrich company extensive real world experience expeditionary spirit innovative think worldwide recruiting staff service llc wrss wholly own subsidiary dyncorp international provide professional recruiting staff solution dyncorp international family company current job listing visit dyncorp international website follow dyncorp international twitter,Public
part dyncorp international work support logistics civil augmentation program logcap morale welfare recreation mwr team organizes great activity troop serve afghanistan easter din facility dfac team forward operating base fob spin boldak brought taste home resident warfighters traditional easter dinner dinner menu include ham grill cornish hen candy yam fruit display typical easter basket treat din area also decorate festively spring flower linen tablecloth mwr personnel organize unique bench press competition camp stone goal competitor lift percent body weight many time could without raise part body weight bench winner divide division light weight middle weight heavy weight earn fun prize mix soldier coalition force di personnel cheer mwr team fob zangabad kept member military station entertain may karaoke night video game tournament weight lift competition member military participate great time express appreciation activity dyncorp international serf one three contractor currently provide support u coalition troop overseas logcap iv contract support limited military operation immediate focus troop deployed middle east task order di provide several service include,Public
dyncorp international feature article july issue military logistics forum article highlight dis innovative supply chain model combine proprietary technology concentrate supply chain operation system use fulfill supply need company customer dis eric george senior vice president supply chain discus model explains functionality able put supply chain place incorporates entire supply life cycle say george entire piece one thing would say progressive idea supply chain truly whole gambit everything company would need buy term service way endgame delivery dis supply chain revolves around centralize supply chain center excellence coe allow consistent source control logistics entire company need coe manages cost analytics e source target source ultimately provide cost saving customer article highlight importance leverage unified supply chain effort cut cost supply effort also evaluate supplier rating system ensure efficient supply management george say provide exponential improvement procurement dis senior leadership also review scorecard monthly individual company performance update provide supplier need article also describes di supply chain hub spoke distribution operation system consolidates supply transport quality control two quality control center qccs one texas another dubai qcc personnel manage material receive perform inspection ship appropriate customer location worldwide dyncorp international supply chain model cite positive factor streamline process play key role protect core business deliver exist capability new customer deliver new capability exist customer dis supply chain team also recently recognize supply demand chain executive pro know award give supply chain executive lead initiative help prepare company supply chain significant challenge today business climate,Public
dyncorp international aviation group celebrate career david rise program director columbus support division csd team picnic columbus air force base afb rise retire january year di team member rise begin career di csd fabrication branch manager later chosen director maintenance dom take division manager dm tenure dom dm leadership csd team excel customer satisfaction strength contract performance david demonstrate u right look like positive leadership style infectious among csd team lead positive work relationship value customer miss personally professionally wish david best life offer thank make difference di model leader truly exemplifies core value say jim myles group vice president aviation dyncorp international fortunately customer di luck continue david successor craig oneal posse skill set necessary continue david legacy superb leadership current role rise serf site manager lead aircraft management staff personnel perform aircraft maintenance aircraft assign support equipment facility interface daily th fly training wing leadership support mission rise utilized year aircraft maintenance experience u air force serve field maintenance superintendent dyncorp international provide organizational intermediate level aircraft maintenance support logistics service u air force air education training command aetc th fly training wing columbus afb mississippi aircraft support aetc columbus afb include c b use air force specialized undergraduate pilot training supt program additional support include base level precision measurement equipment laboratory pmel operation aetc centralize corrosion control center j engine regionalization repair overhaul activity,Public
ninety dyncorp international team member fort worth texas sign participate blood drive held june one pint blood save three life donation drive benefit people donation directly benefit north texas resident collect carter bloodcare via two mobile collection site im proud team member participate drive say amy jones administrative specialist employee assistance program eap ambassador dyncorp international participation weve ever drive honor work carter bloodcare benefit community carter bloodcare found merger two local blood center make carter bloodcare texas large blood center april carter bloodcare also merge tyler texas base stewart regional blood center together provide unit lifesaving blood north central east texas year carter bloodcare profit c organization operates behalf patient love one texas county dyncorp international value apply daily job performance serve care empower perform right thing also value carry community di life work employ ten thousand people around world provide di unique opportunity give back philanthropic donation local training program hand volunteer work learn dyncorp international corporate initiative employee initiative truly help make difference world,Public
u army special operation aviation command usasoac award dyncorp international di task order contract field team cft contract provide aviation support th special operation aviation regiment airborne soar fort campbell ky di meaningful extensive experience contract honor support th soar say jim myles group vice president aviation dyncorp international look forward utilize decade experience usasoac support mission requirement inception early di provide th outstanding aviation service task order award briefly another firm last week u army notify di work return di di team member provide field sustainment level maintenance aircraft aircraft subsystem aviation support system logistics competitively award task order cft indefinite delivery indefinite quantity idiq contract eight month base period two one year option total value million option exercise di employee base fort campbell work dyncorp international already support two contract aircraft maintenance support st airborne division base operation service u army directorate logistics know night stalker th soar army premier night fight aviation force special operation aviation force regiment help pioneer army night flight technique develop night flight equipment contract field team cft program accomplishes depot intermediate organizational level inspection maintenance modification repair operational government location worldwide program support air force requirement air logistics center alcs air combat command acc air mobility command amc air force reserve afres air national guard ang cft contract also use support requirement generate army navy coast guard federal aviation administration faa federal agency cft program provide rapid deployment capability field necessary skilled technician site anywhere free world support government war readiness posture planning need quantity service require determine time requirement generate cite order team requirement little one many thousand technician,Public
dyncorp international participate veteran hire fair host department veteran affair va take place june cobo center detroit mich fair held conjunction national veteran conference nvc veteran register free event expect attend di join employer seek fill open position attendee access coach able distribute resume prospective employer ability schedule interview ahead time senior recruiter hand discus current opportunity di well answer inquiry company information current opportunity dyncorp international visit di recruiting site second large federal agency va provide health care career education financial service veteran family va make three administration veteran benefit administration veteran health administration national cemetery administration office human resource administration hr establish va vet hr support va three administration human resource benefit management diversity inclusion recruiting hire training va workforce dyncorp international experience dedication veteran contribute value employee business partner supplier year di consistently recognize top veteran friendly business year dyncorp international ranked number nine military time edge magazine list best vet employer name one nation top military friendly employer five year row place th g job magazine di also honor sixth year row vetrepreneur magazine one u best corporation veteran own business word deed dyncorp international every day affirms corporate belief value veteran supplier veteran employee di offer extraordinary opportunity challenge assignment people share commitment quality service veteran make important part di team,Public
dyncorp international sponsor th annual blue angel foundation golf tournament held october th del mar country club rancho santa fe calif proceeds event benefit wound warrior foundation warrior freedom station national flight academy also benefit fundraise event blue angel foundation fund support warrior foundation san diego calif provide monetary aid assist honor support military men woman serve sacrifice u military additional fundraise provide support wound warrior freedom station national flight academy scholarship descendant present past blue angel squadron member preservation blue angel history blue angel foundation wound warrior foundation assist seriously injured assign naval regional medical center camp pendleton naval hospital palm fort irwin well go rehabilitation san diego calif area response request wound warrior warrior freedom station create serve support center assist transition back civilian life freedom station provide temporary lodge facility well educational career guidance injured disabled military hero medically retire discharge freedom station volunteer assist provide guidance begin transition become productive member america civilian workforce,Public
dyncorp international di proud exhibitor national defense industrial association special operation force industry conference sofic held may nd th tampa convention center tampa fla di booth provide conference attendee information company support military force throughout world particularly special operation force sof attract government industry attendee exhibit company annual conference exhibition brings together defense industry focus building global sof partnership advance defense industry technology solution every year sofic showcase new emerge technology developed innovator defense industry support special operation force worldwide di personnel share information specialized mission critical service solution aviation land system logistics field operation become essential u special operation abroad attendee exhibitor collaborate networked national international player defense arena gain increase knowledge understand awareness key requirement technology issue face today military fighter commander area special operation u special operation command ussocom commander acquisition executive share perspective challenge trend interest face special operation force develop global sof partnership participant opportunity attend senior industry executive forum attend various session ussocom senior leader panel business opportunity session promote national security since national defense industrial association premier group represent facet defense technology industrial base military service division industrial work group help drive future defense education access influence dyncorp international honor provide service training material allow u special operation force operate safely efficiently mission requirement,Public
dyncorp international senior financial director evonne ruiz highlight summer fall issue hispanic career world magazine article entitle serve country career government defense contract sandra h shichtman profile four individual developed career within government defense contract grow texas rio grande valley ruiz thought would follow family tradition work pharmaceutical however found finance accounting call switch major university texas austin accordingly recommendation one college counselor sent student company past ruiz come di intern work summer junior senior year continued part time employee graduation december role intern include basic accounting task reconcile account balance sheet cash account hard work paid graduation hire full time accountant since move rank current role senior financial director currently handle high level task forecasting budget operating plan financials dyncorp international government operation ruizs say challenge aspect job stay abreast financial issue might impact company operates hour day day year ruiz driven company mission provide quality service u government include accounting work also excellent communication skill people skill flexibility work personnel across globe credit help understand husband balance challenge business role personal life hispanic career world magazine publish equal opportunity publication eop launch recruitment link hispanic student professional employer seek hire hispanic career world offer career guidance column news feature article profile hispanic field eop publishes career guidance recruitment magazine woman member minority group people disability eops slogan first diversity best result summarizes record help job seeker underrepresented group find employment aid company government agency eager recruit diversified workforce,Public
dyncorp international ranked tenth washington technology top th cite reengineered business process corporate infrastructure increase functional back office capability new focus business strategy bolster supply chain function di see seven consecutive quarter growth hungry company agile incredibly lean say dyncorp international president steven schorer comment still work back office infrastructure process model greatly improve washington technology refers several key competes million contract continue provide aircraft maintenance logistics support naval air warfare center aircraft division patuxent river md million contract continue support air force th wing th wing joint base andrew naval air facility washington c new business highlight include contract nasa provide provide aircraft maintenance operational support service broadening aviation group business despite loom government budget cut schorer still expect di continue grow especially area training support logistics military intelligence community weve become aggressive thoughtful strong business process follow schorer say think make real difference u customer continue make difference washington technology top base analysis data federal procurement data systemnext generation washington technology aim capture range technology work mission expertise contractor provide federal government many code might seem directly related system integration information technology get work do part analysis merger acquisition joint venture also factor washington technology brand government contractor system integrator solution provider quarter century government system integrator solution provider management rely washington technology coverage key issue face contractor government initiative effect spending priority rfps procurement regulatory change technology evaluation analysis proposal preparation well merger acquisition news business trend arrival departure within government integrator community,Public
dyncorp international personnel work support logistics civil augmentation program logcap recently support girl scout america project troop troop help send girl scout cooky u military personnel afghanistan project troop troop great initiative give soldier little taste home proud participate program benefit military personnel overseas well di field team work support u national security foreign policy objective logcap program say susan kyzer senior operation supervisor logcap dyncorp international box cooky purchase support program project troop troop initiative box girl scout cooky sent military personnel world troop troop program provide opportunity send well know cooky serviceman woman partnership operation troop aid non profit organization provide care package u service member girl scout cookie purchase make shelby lambert daughter di program financial analyst bobbie lambert whose goal sell box support program assistance di logcap program management office fort worth texas lambert exceed goal girl scout troop also able send hundred box cooky military personnel overseas dyncorp international serf one three contractor currently provide support u coalition troop overseas logcap iv contract support limited military operation immediate focus troop deployed middle east task order di provide several service include,Public
dyncorp international earn champion veteran enterprise award national veteran small business coalition nvsbc federal agency prime contractor meet exceed three percent goal provide opportunity veteran own vosb service disabled veteran own small business sdvosb recognize honor dyncorp international far exceed state target percent vosb percent sdvosb supplier additionally organization go beyond make acquisition process veteran friendly take significant action increase contract subcontract opportunity also recognize partner veteran own service disabled small business provide great value extraordinary service di customer say steve gaffney chairman chief executive officer dyncorp international much business involves support serve help partner live mission firsthand award present vet award luncheon tuesday june reno nev nvsbcs mission transition veteran business owner service federal government vision ensure veteran business give first consideration federal prime subcontract procurement opportunity national veteran small business coalition nvsbc aim engage federal department agency prime contractor small business trade association congress department veteran affair small business committee promote opportunity veteran own service disabled business dyncorp international experience dedication veteran contribute value employee business partner supplier year di consistently recognize top veteran friendly business year dyncorp international ranked number nine military time edge magazine list best vet employer name one nation top military friendly employer five year row place th g job magazine di also honor sixth year row vetrepreneur magazine one u best corporation veteran own business word deed dyncorp international every day affirms corporate belief value veteran supplier veteran employee di offer extraordinary opportunity challenge assignment people share commitment quality service veteran make important part di team,Public
dyncorp international team member support u air force air education training command aetc sheppard flight support division sheppard air force base afb wichita fall texas di provide aircraft maintenance support th fly training wing sheppard afb mission air education training command aetc th fly wing unique provide undergraduate pilot training u north atlantic treaty organization nato ally euro nato joint jet pilot training program enjjpt program establish world multi nationally man manage fly training program graduate prestigious program assign fighter pilot position respective air force di provide skilled mix aviation service manager supervisor mechanic specialist technician support c military training aircraft team member manage schedule maintenance ground handle service launch recovery equipment back shop support transient maintenance include crash damage disabled aircraft recovery recent consolidated unit inspection cui aetc inspector general th fly training wing receive overall excellent rating dis contractor maintenance team receive high possible score inspector proud support u air force essential program also proud di team commitment excellence professionalism exhibit sheppard say jim myles vice president dyncorp international aviation group cui first kind aetc combine inspector general compliance inspection logistics capability assessment program airfield operation compliance inspection aircrew standardization evaluation visit consolidated unit inspection cuis combine numerous evaluation assessment multiple agency obtain comprehensive view wing compliance mission directive oscar j padeway deputy director inspection air force inspector general office secretary air force believe cui initiative could possibly reduce current number inspection day approximately day five year period two week two year period overall goal consolidated unit inspection reduce number functional inspection assessment evaluation impose wing integrate synchronize ig inspection give unit time train sustain constant state readiness say padeway,Public
dyncorp international parent delta tucker holding inc report first quarter operational result revenue million increase first quarter net income attributable holding million quarter represent increase report million net income attributable holding first quarter quarter team successfully expand new excite adjacency say steve gaffney chairman chief executive officer dyncorp international honor support new customer nasa work new market egypt seven straight quarter revenue growth confident team ability secure strong stable future,Public
part go relationship uso metropolitan washington dyncorp international participate usos operation back school school supply drive program provide backpack complete school supply approximately local military child kindergarten th grade first phase operation back school involves donate need supply throughout month may di office fall church va alexandria va among need donation marker crayon composition notebook pencil holder scissors glue stick pencil sharpener addition donate supply di corporate sponsor program di team member volunteer help stuff distribute backpack distribute student fort belvoir uso center fort meade uso center saturday august support military troop family washington c maryland northern virginia uso metropolitan washington active organization offer many event program area military hospital five uso center four uso airport lounge di proud support uso metropolitan washington operation back school many great event support troop help solidify partnership di chairman ceo steve gaffney recently become new member usos board director april comment gaffneys appointment board elaine rogers president ceo uso metropolitan washington say knowledge commitment troop apparent many year work within military community bring much table look forward member dedicate team gaffney state honor join uso metro board director percent employee veteran cause support serviceman woman close heart,Public
