Text,DocType
dyncorp international team member pensacola fla participate veteran airlift command flight help transport wound warrior home crestview fla rehabilitation center key west fla di provide aircraft fly time pilot crew fuel support flight di team volunteer free time fly wound warrior family two hour trip free charge family flight arrange coordination task force dagger foundation non profit organization support soldier family u army special operation command task force dagger sponsor special week long therapeutic dive trip wound warrior family partner veteran airlift command able provide air transport wound warrior travel medical reason might able travel due various circumstance say eric huppert dyncorp international senior program director hope able support flight future huppert learn veteran airlift command program volunteer time angel flight program saw brochure veteran airlift command airport participate angel flight mission thought unique opportunity di continue support u veteran say huppert greatly appreciate dyncorp international support veteran airlift command say jennifer salvati veteran airlift command operation manager easy task many wound warrior travel commercially organization di assist allow fly comfortably way honor well veteran airlift command provide free air transportation post combat wound soldier family medical compassionate purpose national network volunteer aircraft owner pilot,Public
several dyncorp international team member fort worth texas volunteer time support food pantry community storehouse non profit childrens charity tarrant county volunteer help organize pantry sort clothes donation distribute resale shop well donate numerous box kid friendly food support summer lunch program team pleased able support community storehouse able work firsthand great organization reward also fun would like stay longer plan say jennifer gillespie dyncorp international treasury associate definitely look forward work future hope make regular event food drive dis office fort worth donation collect support summer lunch program provide qualify family access food pantry pick food need child summer vacation typically qualify governmental free reduce lunch important hunger prevention program assistance provide june july august community storehouse dedicate keep child active thrive keller northwest independent school district texas community storehouse non profit c childrens charity northeast tarrant county focus mission time time variety seemingly insurmountable obstacle spring child success school severe terminal illness strike parent parent job loss family poverty even sudden death family community storehouse assist child family face challenge variety service education include reading school supply program well help nutrition clothing health care,Public
dyncorp international proud supporter government procurement conference held july arlington convention center arlington texas di sponsor event participate exhibitor sponsor attendance veteran own service disabled veteran own business conference aim expand public sector business small business attendee include department defense prime contractor municipality county school district procurement specialist hand educate small business owner local state federal agency subcontractor look select supplier year year di recognize commitment support veteran work small business office di earn several award support veteran own business service disabled veteran own business seventh year row di name one u five best defense company veteran own business list compile national veteran own business association navoba feature cover april issue vetrepreneur magazine recognizes corporation successfully engage nation three million veteran own business supplier second year row dyncorp international earn champion veteran enterprise award national veteran small business coalition nvsbc federal agency prime contractor meet exceed percent goal provide opportunity veteran own vosb service disabled veteran own small business sdvosb recognize honor di far exceed state target percent vosb percent sdvosb supplier additionally organization go beyond make acquisition process veteran friendly take significant action increase contract subcontract opportunity also recognize,Public
dyncorp international team member fall church alexandria va kick independence day celebration year uso metropolitan washington uso metro firecracker k held reston town center reston va di team member join runner walker deck red white blue mile race host potomac river run proceeds event directly benefit uso metro program initiative support local military family uso metro mobile truck also hand collect school supply benefit operation back school nearly backpack distribute school age military child prepare upcoming school year di team member participate school supply drive collect eraser pencil case donate day race di serve event sponsor also field second large team register runner race along participate k event brought together spectator help celebrate fourth july activity face painting special brunch buffet new year event battle branch competition race participant place vote military branch run dc metropolitan area army eventual winner uso metro receive donation behalf branch race registration fee uso metro nonprofit c organization charter congress dedicate serve serve family washington c maryland northern virginia generous financial support individual organization local community uso metro able fulfill mission help nearly devote volunteer uso metro provide program service active duty troop family area military hospital mobile uso program five uso center four uso airport lounge operation uso care package information visit www usometro org,Public
dyncorp international proud sponsor uso metro afcea dc golf classic fundraiser held july army navy country club arlington va proceeds event directly benefit uso metropolitan washington afcea dc scholarship fund uso metro afcea dc golf classic annual event allows several washington c area business professional meet network wound warrior local military medical facility support two important cause proceeds tournament help uso metro serve troop local family year throughout washington c maryland northern virginia additionally generate support afcea dc scholarship fund student seek degree science engineering mathematics uso metropolitan washington nonprofit c organization charter congress dedicate serve serve family washington c maryland northern virginia generous financial support individual organization local community uso metro able fulfill mission help nearly devote volunteer uso metro provide program service active duty service member family area military hospital mobile uso program five uso center four uso airport lounge operation uso care package promote high education arm force communication electronics association afcea dc award merit base college scholarship eligible applicant washington c metropolitan area since afcea dc award million scholarship region student include recipient represent high school enter u college university afcea dc award multiple single year scholarship amount one single year scholarship amount scholarship open high school senior enter four year accredit degree grant program fall afcea dc also offer single year scholarship student transfer two year community college four year accredit degree grant program fall scholarship award provide qualify student pursue degree c related field engineering electrical computer chemical aerospace system electronics mathematics computer science physic science education mathematics education technology management management information system biology bio medical engineering degree qualify afcea dc scholarship program,Public
second consecutive year dyncorp international proud sponsor uso metropolitan washington uso metro operation back school program program provide backpack complete school supply approximately local military child kindergarten fifth grade year addition participate corporate sponsor di donate calculator backpack school supply drive fall church alexandria va office collect additional supply program di team member volunteer help stuff thousand backpack supply donation fulfil help distribute special back school event held august fort belvoir uso center four star corporate partner di support uso metro program event service support military troop family washington c maryland northern virginia area uso metropolitan washington nonprofit c organization charter congress dedicate serve serve family washington c maryland northern virginia generous financial support individual organization local community uso metro able fulfill mission help nearly devote volunteer uso metro provide program service active duty service member family area military hospital mobile uso program five uso center four uso airport lounge operation uso care package,Public
dyncorp international team member fort worth texas show di care support community storehouse summer lunch program many local child school summer access free reduce price lunch option community storehouse provide qualify family access food pantry summer pick extra kid friendly food need school age child special program di team member chip donate non perishable food item help fill food pantry throughout month june place online donation directly benefit program learn great program community storehouse excite able support say jan gillespie dyncorp international treasury associate treasury risk team member collaborate saw unique opportunity di forth worth team partner local organization support family surround community qualify family able register community storehouse program qualify may come community storehouse food pantry pick extra kid friendly food need child school child normally qualify governmental free reduce lunch program school year experience food insecurity school session important hunger prevention program assistance provide june july august individual wish participate program consult child school counselor see qualify program keep child active thrive keller northwest independent school district community storehouse community storehouse non profit c childrens charity northeast tarrant county focus mission time time variety seemingly insurmountable obstacle spring child success school severe terminal illness strike parent parent job loss family poverty even sudden death family community storehouse assist child family face challenge variety service education include reading school supply program well help nutrition clothing health care,Public
dyncorp international recently donate care share food bank southern colorado support firefighter affected black forest canon city wildfire cause near dear u team member help fight wild land fire say jeffrey cavarra dyncorp international program manager california department forestry fire protection cal fire know firsthand hard firefighter work happy help way thousand colorado citizen force evacuate home fire continue spread dozen home destroyed leave many displace need food shelter essential item information donate care share food bank southern colorado visit http careandshare org care share establish year ago franciscan sister dominique pisciotta referral agency coordinate food distribution southern colorado area organization continued evolve grow simple clearinghouse food distribution complex telephone referral service food bank administrator care share member feed america network focus mainly food distribution addition provide food resource feed america serf resource professional development networking opportunity well coordinate effort product donation distribution disaster situation dyncorp international work cal fire since help suppress control wild land fire california part program di fly maintains grumman fire retardant air tanker ov aircraft fully maintains service civilian uh h super huey helicopter flown cal fire pilot operating across california aircraft reach fire within minute ov aircraft fly fire direct air tanker helicopter critical area retardant water drop retardant use slow retard spread fire slurry mix consist chemical salt compound water clay gum thicken agent color agent airtankers helicopter equip carry fire retardant water helicopter also transport firefighter equipment injured personnel cal fire aircraft strategically locate throughout state airbases helicopter base high fire activity cal fire may move aircraft well provide statewide air support department firefighter fire engine aircraft respond average wildland fire year fire burn acre annually,Public
afghan american woman association awa need help shipping supply need afghanistan dyncorp international answer call dis supply chain team move box material afghanistan last year work theater transportation supplier damco find solution transport awas critical supply proud able support awas effort send winter clothing supply afghan citizen preparation cold winter month say mark mirelez dyncorp international vice president supply chain management awa non profit organization year collect clothing monetary donation send needy area afghanistan local citizen many school age child need warm clothing winter season past year program grown large year increase positive impact need logistically become difficult organization get donation ship use say shahla ahmadi president founder afghan american woman association dis sponsorship assistance truly appreciate honor affiliate company understands importance put human need focus awa found result grow afghan american presence u especially great washington c metropolitan region awas mission serve platform organize afghan american woman cultural educational charitable social activity need afghan american community many potential resource address need awa serf connection need community available resource awas primary goal obtain funding construct community center serve various need community addition continue serve local community provide opportunity educational cultural professional growth association position community organizer provide guidance need appropriate service awas community outreach program include assistance newly arrive immigrant support critically ill afghan family language citizenship class educational presentation community venue youth volunteerism clothing food medicine drive needy afghanistan,Public
dyncorp international shelby faubion vice president corporate internal audit recognize one top rise star internal audit granite consult group award honor high perform member internal audit profession contribute new interest way concept rise star internal audit select highlight leader organization guide internal audit future eventually enhance organization corporate governance finalist chosen independent board judge organization high perform audit function typically succeed adapt industry ever change environment specifically go traditional focus financial audit operational form internal audit team help manage compliance risk management strategic audit award truly see team accomplishment representative executive team dyncorp international value internal audit team contribution di core value right thing always also team commitment perform objective assessment collaborative manner di leadership comment faubion deepest congratulation shelby dyncorp international award process shelby highlight risk assessment management approach believe contribute success name top also enhance dis reputation internal audit community comment michael bechara manage director granite consult group shelby faubion join dyncorp international september experience provide internal audit consult service numerous fortune lead company across number industry professional service career include time two big four audit firm contribute global client delivery methodology thought leadership piece pertain sarbanes oxley compliance enterprise resource planning control integration enterprise risk assessment value add internal audit service faubion graduate texas tech university certify public accountant cpa state texas also certify six sigma greenbelt certify information system auditor cisa certify risk information system control crisc,Public
dyncorp international sponsor sixth annual national defense industrial association ndia midwest small business government contract symposium held may iwireless center moline ill symposium theme develop partnership success two day interchange senior government industry leadership well understand future rock island arsenal business opportunity well present networking opportunity educational workshop briefing update provide u army sustainment command asc enhance army global logistics enterprise eagle logistics civil augmentation program logcap requirement additional breakout session conduct team joint venture international trade fulfil requirement partnership small business along sponsor event kenneth shreves senior director business development speaker panel discussion title market small business prime government di exhibit outreach small business host matchmaking appointment representative small business gain overview capability learn may work di dyncorp international small business office identifies outstanding small business partner work subcontractor outreach program target event small business office currently manages contract accordance u small business administration defense contract management agency department state national defense industrial association ndia america lead defense industry association promote national security non partisan non profit association headquarter arlington virginia iowa illinois chapter arm national association provide geographic coverage iowa western illinois further national objective policy mission,Public
dyncorp international earn premier partner silver status carter bloodcare continuous participation community blood drive fort worth texas area di host two drive year one winter one summer brings di team member donor di team member participate really understand urgent need life save blood north texas area proud consistently demonstrate commitment local community drive say amy jones dyncorp international administrative specialist employee assistance program eap ambassador dis last blood drive held coordination carter bloodcare held january di team member volunteer participate donor contribute unit blood directly benefit north texas resident found merger two local blood center carter bloodcare texas large blood center april carter bloodcare announce merger tyler base stewart regional blood center together provide unit lifesaving blood north central east texas year carter bloodcare primary provider blood component transfusion service approximately texas health care facility accredit american association blood bank license food drug administration affiliate america blood center facility include region childrens hospital central trauma center major cancer center transplant center addition provide blood component patient carter bloodcare also provide specialized laboratory patient care service physician consultation carter bloodcare participates education professional transfusion medicine medical technologist specialize blood banking,Public
dyncorp international proud sponsor firecracker k troop present uso metropolitan washington uso metro race take place july reston towne center reston va part family orient independence day celebration participant greet color guard start line military personnel sing national anthem uso metro military appreciation tent set surround area along blow obstacle course kid face painting runner also enjoy post race buffet live music massage proceeds firecracker k directly benefit local troop family help fund uso metro critical program service provide troop family uso metro fundraise event directly involve community important work support troop usos role lift spirit serviceman woman little thing let know american people behind fundraise effort firecracker k uso metro able put together meaningful event benefit troop washington c baltimore md metropolitan area uso metro private nonprofit c organization dedicate serve serve family washington c maryland northern virginia generous financial support individual organization local community uso metro able fulfill mission help devote volunteer uso metro provide program service active duty troop family area military hospital mobile uso program four uso center four uso airport lounge operation uso care package information please visit www usometro org,Public
dyncorp international parent delta tucker holding inc recently report first quarter financial result highlight include revenue million adjust ebitda million despite u government budget issue shift focus afghanistan team deliver increase earnings strong ebitda margin manage reduction top line say steve gaffney chairman ceo look ahead organizational change make begin second quarter mature expect see even opportunity arise new structure help u achieve efficiency exist business introduce new business group fuel international commercial growth refine organization help u become effective successful deliver service globally first quarter revenue decrease million million compare first quarter primarily driven low content logistics civil augmentation program iv contract war afghanistan wind partially offset million increase revenue aviation group base continued strength new contract win net income attributable first quarter million represent million improvement compare first quarter net income attributable holding benefit improve operating profitability reduce interest expense base million reduction long term debt company report adjust ebitda million first quarter represent revenue increase period,Public
dyncorp international participate special operation force industry conference sofic held may tampa fla tampa convention center di representative provide information dyncorp international worldwide military support focus special operation force sof held national defense industry association ndia sofic networking forum brings together military government academic constituent discus sof related issue attendee opportunity meet industry stakeholder challenge face special operation force theme year annual conference strengthen sof bond event focus four key area address current future challenge special operation force way support include year sofic number event agenda help attendee understand need sof order well support special operation force strengthen sof bond national defense industrial association ndia promote u national security since premier group represent defense technology industrial base u military service division industrial work group use education access influence support future defense national security dyncorp international provide service material training support u special operation force safe efficient deployment mission requirement,Public
enthusiastic runner walker include representative dyncorp international lace run shoe saturday may join sponsor iraqi child foundation sicf k run walk raise fund help iraqi orphan street child dyncorp international sponsor race held fairfax county va fund raise corporate sponsorship online fundraise runner go iraq feed tutor provide support child iraq sicf found two american live work iraq war non profit begin work humanitarian assistance organization offering concerned american well iraqi opportunity take concrete action help orphan mobilize sicf care american united state u embassy baghdad organization help collect distribute food medicine school supply backpack shoe humanitarian supply iraq sicf commit serve catalyst mobilize u international partner support iraq ngo emphasize direct aid hand hand program di value apply job performance serve care empower perform right thing also value personnel carry community live work employ ten thousand people around world provide u unique opportunity give back philanthropic donation local training program hand volunteer work goal support program effort benefit veteran u military law enforcement veteran global education global community development,Public
among mission writes di nasa program manager jim snowden team fly russia pick u astronaut return via russian soyuz capsule international space station di team member participate nasa astronaut kevin ford return united state day aboard international space station ford return earth via russian soyuz space capsule land kazakhstan march next day flown back united state specially equip nasa gulfstream iii maintain crewed nasa dyncorp international team member mission command nasa aircraft operation branch chief pilot bill ehrenstrom pilot dis tom ryan prior mission di mechanic james molina scott leonard johnny scott mike brown keith halkard work diligently de configure aircraft recent research mission configure aircraft direct return mission work entail remove rack research equipment interior furnishing support equipment team instal bed chair medical equipment support astronaut trip back u addition prepare interior mechanic complete schedule maintenance ensure top performance important mission mechanic johnny scott accompany aircraft provide service maintenance need support provide di mechanic ensure mission successful aircraft able provide safe reliable comfortable transportation aircrew passenger next astronaut direct return mission plan mid may meantime aircraft reconfigured resume research mission across north central america di provide aircraft maintenance support nasa national aeronautics space administration since june service include support flight operation maintenance repair alteration aircraft component part support equipment engineering service di also support spaceflight readiness training airborne research development flight test support di employee base houston ellington field nasa johnson space center locate nasa langley research center hampton va,Public
