Text,DocType
heel independence day dyncorp international team member fort worth texas kept patriotic spirit go month participate decoration contest raise donation dallas fort worth uso uso center dallas fort worth international airport recently report percent drop donation use gift packet however number military member passing center nearly last year remain steady di team member rally gather need donation di employee form team decorate donation box collect item travel size snack single serve chip single serve peanut snack cracker trial size toiletry dozen donation collect deliver uso center replenish inventory main uso center available use troop family locate terminal b gate dallas fort worth international airport center amenity include caf area tv lounge computer cell phone use play area xbox area sleep room reading room also small lounge locate terminal gate uso dallas fort worth open june serve military community non profit organization uso serf support personnel branch military family service provide uso dfw free guest make possible generosity north texas community uso private nonprofit non partisan organization whose mission support troop provide morale welfare recreation type service men woman uniform,Public
dyncorp international team member help stuff nearly backpack school supply part uso metropolitan washington baltimore uso metro operation back school program volunteer gather uso warehouse fort belvoir unpack school supply tag backpack form assembly line pack backpack distribution operation back school event take place fort belvoir fort meade di also proud corporate sponsor program third consecutive year volunteer support give much least say starlette joyce dyncorp international human resource generalist principal share laughter fun colleague particularly true operation back school event great bonus grateful work company espouses core value volunteer help strengthen community comment karen laury dyncorp international human resource manager small way help others uso metro operation back school program held annually benefit local military child prepare upcoming school year operation back school fun one day program held fort belvoir va fort meade md military kid age participate activity incorporate core subject reading math science history art complete educational activity child receives backpack complete new school supply uso metropolitan washington baltimore large center charter uso ten location deployable mobile uso provide signature uso service nearly military member family living region travel local airport uso metro nonprofit c organization charter congress dedicate serve serve family washington c maryland northern virginia generous financial support individual organization local community uso metro able fulfill mission help thousand devote volunteer uso metro provide program service active duty troop family area military hospital six uso center four uso airport lounge mobile uso signature program service include holiday program like turkey troop project uso elf emergency housing food assistance care wound ill injured troop caregiver,Public
dyncorp international participate two job fair august representative worldwide recruiting staff service llc wrss wholly own subsidiary dyncorp international available follow event wrss recruiter hand th annual fort rucker area job fair take place august ozark civic center ozark ala event take place p fee attend event open public participant may also attend workshop job fair resume write interview skill personal branding attendee come prepared interview several printout resume wrss team member also attend non commission officer association career expo august p event held tide patrick air force base fla event target towards veteran currently separate military military spouse ncoa congressionally charter c non profit military organization hold career expo completely self support proceeds realize event expense met host event put back benevolent fund association program also donates charitable partner support veteran family job seeker interested join dyncorp international team view open listing apply join online talent network mobile device access di mobile career site potential candidate easily search opportunity simplify navigation phone tablet device,Public
dyncorp international senior contract administrator tracy foster recently feature search employ magazine publication recruitmilitary foster year veteran u air force currently support dis war reserve materiel wrm program yorktown va program management office article foster describes journey military civilian career retire air force chief master sergeant serve contract squadron superintendent gain valuable experience transition di di foster assist proposal pricing model development cost input proposal preparation contract administration function field personnel coordination contract negotiation join company early hope soon earn project manager certification well lean six sigma certification ask could give advice transition military civilian career foster comment always put forward absolute best effort anything want achieve successful continued education must military member maximize use tuition assistance leave military high level education possible never underestimate important military training whether technical leadership quality type training civilian employer value skill everything learn military help new job say spent year strive improve technical knowledge computer ability leadership teamwork skill training education life skill gain air force help make smooth transition dyncorp international dyncorp international great place veteran work culture one professionalism integrity foster say dyncorp international code ethic business conduct help guide behavior business practice company value remind air force core value glad work company place emphasis high standard additionally dyncorp international recognizes proven valuable skill former military member bring company di partner u military transition office support service academy career conference saccs participates u chamber commerce hire hero employment event part company commitment hire veteran veteran support di customer program around world information open opportunity veteran non veteran alike visit dyncorp international career site,Public
dyncorp international team member world focus continuous improvement introduce lean six sigma process dis program aviation logistics operation maintenance training since august lean six sigma training incorporate throughout company certify new lean practitioner lean six sigma green belt achieve dis continuous improvement goal operation team create standardize curriculum certification methodology lean six sigma training responsibility go successfully introduce embrace culture continuous improvement say john bennett continuous improvement senior director dyncorp international integrate lean training help equip team member succeed well serve customer initial success lead dis continuous improvement team expand training support high level certification past green belt black belt master black belt increase overall training event classroom set virtual learn green belt project result already make positive impact metric throughout company comment bennett continuous improvement team also launch toolkit program manager dis center excellence aid manage continuous improvement different level within organization toolkit topic include set goal building competency execute sustain project measure result want empower employee feel confident constantly seek well efficient way thing want make sure measure activity point view customer process standard procedure metric place hold accountable customer expectation say bennett lean six sigma combination two powerful concept lean understand value stream remove waste six sigma reduce variation control process lean accelerates six sigma deliver great result would typically achieve lean six sigma individually combine two method give improvement team comprehensive tool set increase speed effectiveness process within organization result increase revenue reduce cost improve collaboration lean six sigma professional exist every level master black belt black belt green belt lean practitioner conduct project implement improvement,Public
dyncorp international uk recently participate two event highlight capability meet key leader united kingdom land force industry royal united service institute rusi land warfare conference dvd defence vehicle show rusi land warfare conference held june westminster london di team present information highly complex logistics fleet management life supply chain solution exhibit well throughout conference hall dyncorp international senior program director richard mcevoy feature speaker panel discuss topic work partner generate fight power lead dis afghan ministry interior afghan national police program amdp described important distinct role contractor play operation world ian copeland dyncorp international uk manage director moderate panel land warfare conference held annually behalf uk chief general staff brings together representative across arm force government academia industry well international ally partner aim promote professional debate issue matter land force community year conference focus history teach british way war consider insight offer present shape future land force th dvd event host uk army defence equipment support organisation take place june widely attend organization equipment support sustainment industry uk arm force dyncorp international uk large stand event promote dis capability host busy programme meeting attendee gain insight equipment use british army directly military personnel bring together industry defence land equipment sector develop idea generate great understand technology capability requirement event focus recognize new capability role take army part defence transformation,Public
bake sale fundraiser dyncorp international team member fort worth texas raise benefit cancer care service local organization provide help hope cancer patient survivor family caregiver direct financial emotional social service employee create team man table full sweet treat garner donation cake raffle unique bake good team represent supply chain center excellence raise nearly stand blown away say brandy wicker chief development officer cancer care service overwhelmed move effort di employee fund raise benefit cancer patient survivor dallas fort worth metro area several di team member also volunteer time national cancer survivor day event held cancer care service june resource connection tarrant county gymnasium fort worth texas volunteer help set booth table decoration well assist craft food service registration clean client event give cancer boot free attend cancer survivor family caregiver cancer care service provide help hope cancer patient survivor family caregiver direct financial emotional spiritual social program service activity agency assist cancer patient tarrant hood parker county diagnosis survivorship necessary end life issue financial support include assistance cancer related prescription health insurance premium nutritional supplement transportation medical equipment supply emotional program include case management license social worker well short term counsel support group wellness event art music therapy agency serve client provide direct financial assistance,Public
second year row dyncorp international proud sponsor fifth annual firecracker k troop take place july reston towne center reston va net proceeds event corporate sponsor donate uso metropolitan washington baltimore uso metro help fund critical program service serve nearly military member living washington baltimore region travel local airport year race part large family friendly community event celebrate independence day support local troop family race also feature battle branch potomac river run make donation behalf military branch runner register mobile uso truck also hand collect donation pencil sharpener notebook contribute uso metro operation back school program provide nearly local military child backpack fill school supply uso metropolitan washington baltimore large center charter uso nine location deployable mobile uso provide signature uso service nearly military member family living region travel local airport uso metro nonprofit c organization charter congress dedicate serve serve family washington c maryland northern virginia generous financial support individual organization local community uso metro able fulfill mission help nearly devote volunteer uso metro provide program service active duty troop family area military hospital five uso center four uso airport lounge mobile uso signature program service include holiday program like turkey troop project uso elf emergency housing food assistance care wound ill injured troop caregiver,Public
dyncorp international ranked th washington technology top list large contractor government market accord system integration telecom professional service high tech revenue last year di ranked di restructure three strategic business group dynaviation dynlogistics dynglobal dynaviation group provide full spectrum aerospace aviation air operation solution worldwide dynlogistics group provide total support solution include conventional contingency logistics operation maintenance support platform modification upgrade supply chain management training security full spectrum intelligence mission support service dynglobal group focus opportunity deliver dis vast array capability foreign government international customer di several key contract win contribute successful year within dynaviation group di award regional aviation sustainment maintenance west region rasm w army field maintenance afm contract value million contract field team cft program task order support u navy solomon md value million dynaviation team also form strategic alliance sierra nevada corporation snc integrate mission system ims provide aviation maintenance support lead new subcontract award provide contractor logistics support afghanistan multi sensor aerial intelligence surveillance reconnaissance maisr operation sustainment program dynlogistics group key contract win include defense logistics agency dla contract provide logistics support agency equipment afghanistan new award support u army total package fielding tpf family medium tactical vehicle mtvs di chairman ceo steven gaffney credit dis stability company continued focus core competency stay work gaffney say interview washington technology stick core offering different manner different customer also comment dis intentional culture include tenet help create future keep team member look ahead term business success fiscal thing thought could happen happen say year like question becomes read tea leaf early enough get ahead competition weve spent last four year building value base culture dyncorp international gaffney add value include focus future moment,Public
heel national cancer survivor day celebrate annually first sunday june dyncorp international team member mclean va support american institute cancer research aicr host fundraiser bake sale food truck lunch partner fava pot food truck team member bake variety sweet sell donation raise support aicrs cancer research prevention treatment survivorship program addition di office host fava pot food truck donate lunch sale aicr national cancer survivor day annual treasure celebration life held hundred community nationwide around world celebration survive inspiration recently diagnose gathering support family outreach community participant unite symbolic event show world life cancer diagnosis meaningful productive even inspire day provide opportunity people living history cancer include america nearly million cancer survivor connect celebrate milestone recognize support along way national cancer survivor day foundation defines survivor anyone living history cancer moment diagnosis remainder life american institute cancer research aicr cancer charity foster research relationship nutrition physical activity weight management cancer risk interprets scientific literature educates public result contribute million innovative research conduct university hospital research center across country aicr publish two landmark report interpret accumulate research field commit process continuous review aicr also provide wide range educational program help million american learn make dietary change low cancer risk award win new american plate program present brochure seminar website www aicr org aicr member world cancer research fund international wcrf,Public
kevin todd bynum lead maintenance test pilot work support u department state bureau international narcotic law enforcement affair inl aerial drug eradication program colombia posthumously honor department state name add inl memorial wall bynum die september aircraft crashed counter narcotic spray operation bynum work dyncorp international subcontractor time death recognize special ceremony held u department state harry truman building washington c held june family inl personnel dyncorp international representative attend ceremony today u department state honor memory accomplishment individual whose name appear wall service ultimate sacrifice nation work promote peace security abroad make world safer well place improve life people country serve contribution must never forgotten memory always live say assistant secretary state bureau international narcotic law enforcement affair william r brownfield statement secretary state john kerry address attendee well day forward spot bill described place thoroughfare moment people work family much solemnity much reverence honor men woman contractor federal employee alike give full measure capacity service country commitment bureau international narcotic law enforcement mission abroad say kerry much list name legacy story individual story one human face tell story brave person serve country continued u department state bureau international narcotic law enforcement affair commission memorial wall honor die serve behalf inl bynum work di subcontractor east plan colombia program time death born memphis tennessee grow canton mississippi later settle mooresville n c fianc chaille prestwood expect second child time death,Public
dyncorp international chairman chief executive officer steven gaffney recently feature speaker panel discuss aerospace supply chain global aerospace summit held abu dhabi united arab emirate uae panelist discuss respective business position business growth current aerospace industry environment question answer session gaffney discuss current aerospace industry trend include focus best value service provider importance retain talented personnel increase need knowledge transfer component global program also discuss change role service contractor aerospace maintenance integration highlight supply chain involvement form partnership strategic alliance global aerospace summit invitation event c level executive senior decision maker government official involve aerospace aviation defence space industry summit comprise three day strategic level discussion close door debate networking site visit industry leader attend event take place april st regis hotel saadiyat island abu dhabi uae development global aerospace summit driven need cross industry thought leadership forum allow international peer engage strategic forward look debate address key challenge face aerospace aviation space defense industry topic include partnership competition globalization supply chain workforce development theme summit role aerospace industry regional national economic diversication di rich history aviation maintenance support date back origin di award first contract field team cft contract air force logistics command aflc contract field team provide mission support depot level repair u military aircraft weapon system worldwide di predecessor provide service cft program continuously ever since today dynaviation group di team member around world support type aircraft u foreign government customer di team provide organizational line intermediate limited depot level maintenance front line fighter commercial transport aircraft,Public
dyncorp international team member sarajevo afghanistan work together provide support flood victim bosnia croatia serbia ten thousand lose home due bad flood hit area record history catastrophic rain left third bosnia water landslide trigger flood also raise risk injury death land mine left bosnia war embody di core value care di team member sarajevo office worldwide recruiting staff service llc wrss wholly own subsidiary dyncorp international come together collect food hygiene item flood victim team coordinate donation organization security cooperation europe osce red cross hire notable number people bosnia say nermina memic international recruiting center manager flood affect many employee family team member kandahar air field afghanistan also raise fund flood victim raise deliver directly red cross bosnia member di team,Public
u army red river army depot rrad sign agreement dyncorp international di enhance dis land system life cycle support capability rrads mission valuable one u military department defense capability remanufacture road wheel tracked vehicle system primary depot source mine resistant ambush protect vehicle agreement benefit customer worldwide di excels land system life cycle support management public private partnership combine dis skill rrads depot level operation expertise excite potential partnership look forward building strong competitive alliance state colonel doyle lassitter commander red river army depot dis vice president operation echoed col lassitters enthusiasm partner red river army depot give di technically proficient partner land system life cycle support business say michael herrington additionally agreement bolster dis ability provide state art solution unparalleled ability meet surge requirement utilize u army vehicle depot system red river army depot locate texarkana texas mission change year depot adjusts mission capability meet evolve need u military people equipment facility support today war fighter rrads personnel work depot deploy overseas keep ground vehicle optimal performance level sustain combat tactical fleet,Public
dyncorp international chairman chief executive officer steven gaffney discuss role service contractor part atlantic council captain industry series tie observance memorial day holiday gaffney described sacrifice contractor also make serve mission around world familiar stand awe dedicate life military service another group individual serve well say gaffney even though service sacrifice become accepted part mission cadence u government contract industry unfortunately service sacrifice far less celebrate di team member serve world support program aviation logistics training intelligence operational solution gaffney described role pilot help fight wildfire sky aviation maintenance specialist service aircraft carry top elect official united state memorial day bit different u di many colleague contractor community memorial day know ill think brave men woman military serve paid ultimate price also contractor lose life serve well say gaffney thank service sacrifice date di team member lose life support u government ally country mission honor colleague memorial wall team member name instal dis new global headquarters building mclean va atlantic council promotes constructive leadership engagement international affair base central role atlantic community meeting global challenge found council provide essential forum navigate dramatic shift economic political influence shape twenty first century educate galvanize uniquely influential nonpartisan network international political business intellectual leader captain industry series platform senior defense industry executive address public interest company serve public policy shape market,Public
dyncorp international name finalist washington business journal corporate philanthropy award corporate philanthropy give category finalist include region active inspirational company nonprofit make difference community financial volunteer philanthropic work honoree company list compile washington business journal organize local give dollar volunteer hour well law firm pro bono hour ranking numbered company list announce breakfast award program additional award also present include citizenship award finalist national jefferson award public service dyncorp international team member world base action decision set share value embrace core value di support several organization benefit community live work great washington c area di support several organization include tragedy assistance program survivor tap uso metropolitan washington baltimore uso metro di support tap annual honor guard gala several fundraise event year di also participate first ever tysonsregional chamber k corporate challenge raise tap event di also raise last year benefit tap unique red shirt friday campaign also di name four star level corporate partner uso metro name circle star elite award bestow top level corporate supporter uso metro important mission lift spirit military service member family di support many uso metro program benefit local military family include uso project elf turkey troop operation back school,Public
