Text,DocType
provide overview current terrorism risk insurance program general background issue summary current legislation,Private
may president george w bush issue national security presidential directive nspd also identify homeland security presidential directive hspd national continuity policy directive update longstanding continuity directive design assure govern entity able recover wide range potential operational interruption executive branch effort assure essential operation similar broadly integrate many private sector industry government continuity planning also incorporates effort maintain preserve constitutional government base assumption certain essential activity typically provide government must carry little interruption circumstance,Private
th congress may examine relationship united state wto two way congress may consider implement legislation potential doha round agreement u trade promotion authority tpa expire july however congress may extend reauthorize tpa consider agreement secondly congress may consider change u law response wto dispute settlement procedure,Private
livestock industry group animal health official u department agriculture usda work establish nationwide identification id system capable quickly track animal birth slaughter deal animal disease satisfy foreign market specification consumer group among believe id also would useful food safety retail label purpose producer support new program fear costly intrusive th congress measure animal id traceability provision include h r h r h r h r h r,Private
federal material witness statute provide appear affidavit file party testimony person material criminal proceed include grand jury proceed show may become impracticable secure presence person subpoena judicial officer may order arrest person treat person accordance provision section title relate bail material witness may detain inability comply condition release testimony witness adequately secure deposition detention necessary prevent failure justice release material witness may delayed reasonable period time deposition witness take pursuant federal rule criminal procedure u c response objection authority misuse h r report house judiciary committee require justice department report use authority grand jury context provision drop bill take sent president passage provision would rewrite section among thing establish explicit demand standard arrest detention impose explicit time limitation detention,Private
throughout history national railroad passenger corporation amtrak envision profit corporation fail achieve profit need rely annual federal subsidy survival despite enough support congress time also white house provide enough subsidy keep amtraks train run however enough federal state financial support amtrak money lose would add least time mismanage operation develop route robust national network intercity passenger rail advocate hop amtrak teeter edge shutdown many time save federal subsidy raise question national intercity rail network matter,Private
provide overview significant congressional presidential regulatory reform effort within past year report reference numerous statute executive order govern federal rulemaking process,Private
provide overview federal land resource manage agency manage land authority land manage issue associate federal land management,Private
provide overview federal rulemaking process discussion major law executive order prescribe procedure agency apply promulgate regulation,Private
summarizes food quality protection act fqpa enact th congress public law also analyzes issue regulation pesticide sale use potential impact fqpa amendment federal insecticide fungicide rodenticide act fifra federal food drug cosmetic act ffdca appendix describes authority provision fifra ffdca amend fqpa appendix b provide section section summary public law,Private
response grow concern availability student loan academic year congress pass ensure continued access student loan act h r p l sign law may act raise loan limit stafford loan claim would reduce demand private student loan provide new option parent borrower expands lender last resort program allows secretary education purchase ffel student loan asset lender secretary announce plan purchase student loan originate school year member congress participant student lending market call consideration additional measure might introduce liquidity market securitized student loan use federal financing bank federal entity,Private
february legislation introduce would open way commercial cultivation industrial hemp united state h r th congress h r industrial hemp farm act would amend section control substance act u c specify term marijuana include industrial hemp change would mean state law would determine whether producer could grow process industrial hemp within state border state regulation currently drug enforcement administration dea determines whether industrial hemp production authorize state statute permit enforces standard govern security condition crop must grown,Private
discus win incumbent ilkham aliyev azerbaijan october presidential election describes campaign result examines implication azerbaijani u interest,Private
describes title xii house pass h r th congress section deal electric power issue part title xii would create electric reliability organization ero would enforce mandatory reliability standard bulk power system ero standard would approve federal energy regulatory commission ferc title ero could impose penalty user owner operator bulk power system violates ferc approve reliability standard title also address transmission infrastructure issue secretary energy would able certify congestion transmission line issue permit transmission owner permit holder would able petition u district court acquire right way construction transmission line exercise right eminent domain provision would require ferc approve participant funding new transmission line remove markup house committee energy commerce,Private
usa patriot improvement reauthorization act reauthorization act p l stat contains number death penalty related provision create new federal capital offense make certain death result maritime offense punishable death add death penalty sentence option case pre exist federal crime outlaw attack mass transit make procedural alteration govern federal habeas corpus provision state death row petitioner proposal offer th congress follow pattern new crime new penalty old crime procedural adjustment adam walsh child protection safety act p l stat none proposal enact although one house approve several among h r would amend venue provision capital case make federal capital offense use facility interstate commerce commit multiple murder another commit murder relation drug traffic offense would h r h r h r would make federal capital offense murder federally fund public safety officer h r would create special expedite habeas review state child murder case would make murder commit course certain federal offense capital offense capital proposal pending adjournment h r would abolish death penalty federal sentence alternative h r would impose moratorium bar state impose carry death penalty,Private
federal law promise criminal defendant proper venue e trial district federal crime commit crime commit district conduct element commit offense commit entirely within single district must try others begin one district complete another may try occur unless congress limited choice venue particular offense conspiracy may try district overt act furtherance commit least commission overt act element conspiracy statute issue crime commit beyond territorial confines united state usually try district accuse first brought court may grant change venue behest defendant avoid undue prejudice convenience party sentence purpose abridge cr report rl venue legal analysis federal crime may try charles doyle strip footnote citation authority found longer related report include cr report r venue federal criminal prosecution proposal th congress charles doyle,Private
highlight difference construct tailor deterrence general concept strategic deterrence guide u nuclear policy cold war identifies number issue congress might address review difference include question whether detailed tailor attack plan likely enhance deterrence likely lead early use nuclear weapon question whether tailor deterrence provide guidance future size structure u nuclear force,Private
multiple proposal advance program reduce greenhouse gas introduce th congress report may senate committee environment public work amend consider senate june vote invoke cloture fail general proposal would create market base greenhouse gas reduction program along line trading provision current acid rain reduction program establish clean air act amendment present side side comparison major provision bill include glossary common term appendix c,Private
discus statutory congressional rule structure member house senate exception gift rule may generally accept private source register lobbyist register foreign agent necessary travel expense include transportation food lodge travel connection official duty factfinding trip conference symposium certain circumstance limitation,Private
begin examine save rate measure data show next discus asset value appreciation affect household save behavior finally ass decline household save rate mean respect retirement security national economy,Private
examines u exposure tsunami earthquake early warn system currently place detect risk also examines unique nature catastrophic risk challenge private insurer reinsurers face insure risk finally report summarizes historical effort implement federal program insure mitigate risk associate large scale natural disaster,Private
us regression analysis quarterly national data sub sample answer three question first high import systematically correspond period high unemployment low employment growth second high trade deficit correspond high unemployment low employment growth third high import trade deficit correspond weak growth average worker compensation,Private
view grow impact hedge fund variety financial market security exchange commission sec october adopt regulation require hedge fund register investment adviser disclose basic information operation open book inspection regulation take effect february june court challenge upheld rule vacate h r would reinstate sec authority h r would require define benefit pension plan disclose investment hedge fund december sec propose raise accredit investor standard permit invest hedge fund investor would need million asset instead million,Private
drop demand farmer ask receive compensation assistance cigarette manufacturer federal government manufacturer pledge billion payment farmer year also congress approve million tobacco loss payment farmer fy million fy another million fy million fy addition loss crop price support loan stock amount million shift taxpayer,Private
federal government affect supply demand various agricultural good farm income support food donation program u department agriculture usda provide payment farmer landowner produce certain program commodity rank commodity level support depends criterion time period fy fy usda expect spend billion annually farm payment total outlay feed grain receive support total follow wheat dairy cotton however use different criterion base proportion crop revenue government payment rice peanut wool mohair receive high percentage revenue government cotton wheat feed grain usda also purchase program commodity non program commodity process product use domestic international food aid program fy usda purchase commodity total billion domestic food assistance billion international food aid beef purchase commodity domestic program total follow cheese chicken child nutrition school lunch program significant user commodity wheat purchase commodity international food aid program,Private
congress require overseas private investment corporation u agency whose program potential adversely affect environment abroad develop follow establish set guideline mitigate environmental impact program,Private
u firm long receive tax benefit operation puerto rico u possession clinton administration several year propose extend modify credit beyond expiration date several proposal congress would also modify extend credit,Private
part response september terrorist attack world trade center pentagon president george w bush formally declare national emergency september pursuant national emergency act president action follow long stand tradition alert nation crisis threaten public order constitutional government current arrangement declaration also allow president make use activate authority selective basis appropriate respond emergency hand provision law may brought force emergency declaration chronicle action take president bush pursuant national emergency declaration well issuance additional declaration concern terrorism,Private
start background information data commercial relationship discus selective issue associate trade agricultural product trade service foreign direct investment conclude section ass prospect future cooperation conflict,Private
recent year numerous study address various concern provide recommendation regard u foreign aid policy funding structure view range general approval f process first step toward well coordination aid program need build strong criticism creation f bureau inadequacy coordinate reform much wrong foreign aid need replace cabinet level department foreign aid study survey congressional research service cr emphasize different aspect importance u foreign assistance agree foreign assistance must reform improve effectiveness recommendation category cr identifies enhance civilian agency resource support study cover report next two often cite recommendation raise development equal status diplomacy defense increase need base foreign aid encourage recipientgovernment ownership aid effectiveness half study urge great congressional role foreign aid budgeting policy formulation,Private
track foreign aid funding level latin america caribbean last three year annual state department foreign operation related program appropriation bill vehicle congress fund foreign assistance program congress complete action fy funding consolidated appropriation act division j h r pass week december congress likely continue take interest number related issue include level aid effectiveness counternarcotics assistance best address spread hiv aid address poverty region,Private
since united state impose sanction burma include congressional passage burma freedom democracy act p l ban import burma renew congress bush administration propose u n security council consider burma situation introduce resolution council december china russia vetoed resolution january block u attempt secure security council consideration sanction september since administration issue several executive order prohibit u financial dealing impose travel ban name burmese individual company connect spdc,Private
overview u foreign assistance middle east fy fy fy budget request include history aid region review foreign aid level description select country program analysis current foreign aid issue update periodically reflect recent development foreign aid terminology acronym see glossary append report,Private
guide one regular appropriation bill congress considers year design supplement information provide house subcommittee foreign operation senate subcommittee state foreign operation related program summarizes status bill scope major issue funding level related congressional activity,Private
united state lao people democratic republic lpdr cooperate important area despite disagreement regard human right policy lao lpdr strong tie china vietnam area u lao cooperation include recovery american miss action mias counter narcotic effort removal land mine avian flu social economic condition lao reportedly improve area country upgraded tier u state department traffic person list make significant effort curtail traffic although significant problem remain religious freedom reportedly improve particularly urban area opium production use drop dramatically since country reportedly make progress deepen economic reform prepares apply membership world trade organization wto,Private
thursday may house senate approve compromise h r bill provide billion supplemental appropriation fy president sign bill law p l may bill set deadline withdraw troop iraq establish political security benchmark progress iraqi government make provision new economic assistance iraq conditional achieve specific goal h r p l provide billion new funding amount billion department defense billion military operation billion military construction billion military base realignment closure bill also provide billion international affair include assistance iraq afghanistan bill provide billion domestic program include billion hurricane relief billion administration request billion agricultural disaster assistance billion veteran health program billion homeland security measure million state child health insurance program shortfall million fire fight million secure rural school million variety small program final bill provide fund pandemic flu preparedness low income energy assistance include earlier measure,Private
march senate foreign relation committee order report foreign affair authorization act fy division b measure designate foreign assistance authorization act fy text largely pattern foreign aid authorize legislation debate pass senate last year division b authorizes billion foreign assistance program funding many economic military aid activity level request administration fy division b also incorporates two policy initiative radiological terrorism security act global pathogen surveillance act,Private
speech march president bush outline proposal united state increase foreign economic assistance fy fy american aid would billion high three year earlier new fund would place millennium challenge account mca available competitive basis country demonstrate commitment sound development policy u support believe best opportunity achieve intend result congress play key role mca initiative consider authorization funding legislation confirm head ceo propose millennium challenge corporation number issue likely address congressional debate include country eligibility criterion performance indicator creation new agency manage mca budget consideration,Private
describes history issue involve longstanding difference congress executive branch u policy toward indonesian military abri describes two past episode difference broke period indonesian radicalism president sukarno early initial year indonesian military occupation east timor late outline different view indonesian military congressional critic executive branch official promote close u relation issue congress bush clinton administration discuss within framework culminate american policy toward abri indonesia economic political crisis lead downfall president suharto specific issue discuss report include u training indonesian military personnel u arm sale indonesia likely come new legislative attention near future,Private
several meeting russian president vladimir putin president george w bush state administration work congress grant russia permanent normal trade relation pntr status change russia trade status require legislation lift restriction currently apply russia title iv trade act include freedom emigration requirement jackson vanik amendment november u russian official sign bilateral agreement russia accession world trade organization wto step allow russia move much closer accede wto member may confront issue whether grant russia pntr second session th congress,Private
president bush member congress analyst outside government suggest united state provide threat reduction nonproliferation assistance nation outside former soviet union highlight difference among proposal propose expand assistance contain proliferation others support program stop terrorist acquire weapon mass destruction wmd support assist nation wmd program others believe assistance go nation material knowledge could contribute wmd program support assistance storage elimination weapon others believe united state lock material might use wmd believe united state fund expand program exist budget nonproliferation threat reduction assistance others support large increase exist budget,Private
recent incident involve leak classify information heighten interest legal framework governs security classification access classify information penalty improper disclosure classification authority generally rest executive branch although congress enact legislation regard protection certain sensitive information supreme court state president inherent constitutional authority control access sensitive information relate national defense foreign affair court found congress without authority legislate area provide overview relationship executive legislative authority national security information summarizes current law regulation form legal framework protect classify information,Private
terrorist attack september subsequent discussion religious extremism call attention islamic puritanical movement know wahhabism salafiyya al qaeda leader ideological supporter advocate violent message suggest root conservative islamic tradition observer accuse saudi arabia birthplace wahhabism disseminate religious ideology promotes hatred violence target united state ally saudi official strenuously deny allegation provide background tradition relationship active terrorist group also summarizes recent charge response include finding final report commission relevant legislation th congress,Private
two basic method use senate bring legislation floor consideration senate majority leader request grant unanimous consent take matter agrees motion proceed consider motion proceed subject debate circumstance frequently use method derive basic premise senate body may decide matter considers senate may also use two method bring executive business nomination treaty,Private
convention elimination form discrimination woman cedaw pending senate foreign relation committee since submission president carter treaty require state party take appropriate measure eliminate discrimination woman political public life law education employment health care commercial transaction domestic relation committee briefly consider treaty full senate never do clinton administration repeatedly express support ratification ask senate give approval ratification provide overview convention u position possible adherence,Private
th congress continued consider ocean policy management recommendation two commission report president response approach range comprehensive change ocean governance administrative structure propose ocean conservation education national strategy st century act h r specific topic reauthorization coral reef conservation act h r,Private
bush administration complete congressionally mandate nuclear posture review december review lead major change u nuclear policy fy request include four nuclear weapon initiative rescind ban congress impose r low yield nuclear weapon million advanced concept initiative begin certain study weapon related science technology million continue study robust nuclear earth penetrator exist bomb would convert weapon able penetrate ground detonate improve ability destroy bury target million enable united state conduct nuclear test within month presidential order test related purpose provide policy context four initiative present description history fy legislative action issue congress,Private
large extent committee considerable flexibility go mark measure matter instance th congress committee rule senate foreign relation committee stipulate insofar practicable proceeding committee conduct without resort formality parliamentary procedure comparison committee identify detailed procedure markup meeting,Private
senator introduces bill measure senate call sponsor senator may together submit bill first name senator consider chief sponsor others consider cosponsors bill one chief sponsor,Private
biosafety protocol convention biological diversity adopt early address safe handle transfer trade biological organism protocol set forth procedure rule concern trade biological product include genetically modify organism gmos engender controversy especially use agricultural crop rule key importance u economic interest agriculture well deal genetically modify organism provide summary key provision protocol major issue associate,Private
economy east asia adopt variety foreign exchange rate policy range hong kong currency board system link hong kong dollar u dollar independently float exchange rate japan philippine south korea economy asia adopt manage float allow local currency fluctuate within limited range time part large economic policy,Private
discus two potential role international monetary fund imf may help resolve current global financial crisis immediate crisis control balance payment lending emerge market less developed country increase surveillance global economy well coordination international financial regulatory agency,Private
