Text,DocType
august p l protect america act sign law president bush pass senate august house representative august measure introduce senator mcconnell august make number addition modification foreign intelligence surveillance act fisa amend u c et seq add additional reporting requirement originally pass law sunset day february january house senate pass h r day extension sunset protect america act allow time consider pas go conference propose legislation amend fisa ensure intelligence community would authority need intervene period sign law january become p l february house reject h r would extend sunset provision additional day bill introduce senate extend sunset day extend july,Private
ass recent international development leader number nation work reach consensus informal set best practice regard national restriction foreign investment national security purpose also provide one possible approach assess cost benefit involve use national policy direct restrict foreign direct investment national security reason within united state consensus yet among member congress congress administration work set parameter establishes functional definition national economic security implication foreign direct investment part issue reflect differ assessment economic impact foreign investment u economy differ political philosophical conviction among member congress administration,Private
h r senate judiciary committee amendment nature substitute include amendment foreign intelligence surveillance act provide side side comparison provision three measure glossary fisa term section fisa u c attach fisa bill also introduce bill include side byside comparison,Private
relies comprehensive set data capital flow represent purchase sale u government security u foreign corporate stock bond united state collect treasury department monthly basis,Private
provide overview role foreign investment play u economy assessment possible action foreign investor group foreign investor might choose take liquidate investment united state concern potential impact disinvestment grown national government become active investor uncertainty risk associate security back sub prime mortgage increase volatility financial market,Private
section intelligence reform terrorism prevention act p l amend definition agent foreign power foreign intelligence surveillance act fisa u c b add new category cover individual lone wolf provision non united state person engages international terrorism activity preparation international terrorism deem agent foreign power fisa provision change procedure use apply court order authorize electronic surveillance physical search fisa order sought definition agent foreign power however applicant require demonstrate connection target electronic surveillance physical search foreign nation foreign group international terrorist group foreign intelligence surveillance court fisc approve order find probable cause believe connection exist rather court authorizes surveillance physical search use definition agent foreign power fisc judge find pertinent part base upon information provide applicant order target engage engage international terrorism activity preparation therefor operation sunset provision section usa patriot improvement reauthorization act p l amendment definition agent foreign power fisa cease effect december,Private
foreign corrupt practice act enact principally prevent corporate bribery foreign official act three major part require keep corporation accurate book record account require issuer register security exchange commission maintain responsible internal accounting control system prohibit bribery american corporation foreign official number year passage act congress debate amend response numerous criticism august president sign law omnibus trade competitiveness act title v know foreign corrupt practice act amendment amendment maintain three major part act significant change make one change enact know standard order find violation act standard intend encompass conscious disregard willful blindness amendment provide certain defense find violation act gift lawful law foreign country gift bona fide reasonable expenditure performance execution contract foreign government act amend order implement organization economic cooperation development convention combat bribery foreign public official international business transaction amendment expand scope coverage include foreign person extend jurisdiction beyond border united state,Private
president generally see exercise broad discretionary authority develop implement u direct investment policy include authority suspend block investment threaten impair national security congress also directly involve formulate scope direction u foreign investment policy member urge president aggressive block certain type foreign investment confrontation reflect vastly different philosophical political view member congress congress administration role foreign investment play economy role economic activity play context u national security policy july congress assert role make conduct foreign investment policy adopt president sign p l foreign investment national security act law broadens congress oversight role explicitly include area homeland security critical infrastructure separately identifiable component national security president must consider evaluate national security implication foreign investment transaction act may well draw congress great dialogue possibly great conflict administration effort define limit broad rubric national economic security,Private
constitution united state make specific allowance one co equal branch access information held others contains provision expressly establish procedure right public access government information nonetheless congress legislate various public access law include two record access statute freedom information act foi act foia u c privacy act u c two meeting access statute federal advisory committee act faca u c app government sunshine act u c b moreover due american separation power model government interbranch conflict accessibility information neither unexpected necessarily destructive federal court historically reluctant review resolve political question involve information dispute congress executive branch although considerable interbranch cooperation conflict probably continue occur occasion,Private
usa patriot act section originally set sunset december house pass legislation amend extend expire section h r conference report resolve difference issue h rept order provider time consideration expiration date extend twice first february p l recently march h r p l,Private
part war terrorism widely recognize u government substantial grow need personnel knowledge foreign language especially language may spoken limited remote area world federal government employ thousand translator interpreter four agency responsible security related function addition agency employ nearly staff position require foreign language proficiency yet widespread consensus requirement foreign language qualify personnel currently met report issue commission july make several reference deficiency suggests corrective action address,Private
overview forfeiture sketch origin general attribute forfeiture describes distribution hundred million dollar generates outline constitutional issue raise,Private
electronic surveillance modernization act h r th congress one number bill introduce senate house representative address various aspect tsp variety approach electronic surveillance terrorist affiliate bill design enhance flexibility electronic surveillance acquire foreign intelligence information require increase reporting congressional oversight activity measure introduce july pass house september summarizes bill pass house analyzes potential impact provision become law th congress may wish contemplate similar different approach issue may choose forego legislation light new fisc order anticipate termination tsp continue congressional oversight,Private
destructive aspect foreign outsource costly distress whose job lose increase import therefore matter efficiency equity intertwine one principal challenge policymakers face foreign outsource trade general find way ameliorate associate harm without sacrifice economy wide gain trade generates compensation loss adjustment assistance thought economist offer best chance secure high economic efficiency along distributional equity,Private
continued rise china trade surplus united state world complaint u manufacturing firm worker competitive challenge pose chinese import lead several member call aggressive u stance certain chinese trade policy deem unfair among value china currency renminbi yuan relative dollar july china pegged currency u dollar july china announce would let currency immediately appreciate link currency basket currency rather dollar although yuan appreciate since many member complain china continue manipulate currency order gain unfair trade advantage result u job loss numerous bill introduce induce china adopt flexible currency policy,Private
current legislative oversight activity respect electronic surveillance foreign intelligence surveillance act fisa drawn national attention several overarch issue briefly outline three issue touch upon perspective reflect ongoing debate issue include inherent often dynamic tension national security civil liberty particularly right privacy free speech need intelligence community able efficiently effectively collect foreign intelligence information communication foreign person locate outside united state change fast pace technologically sophisticated international environment united state person abroad differ approach suggest meet need limitation liability electronic communication service provider furnish aid federal government foreign intelligence collection two constitutional provision particular implicate debate fourth first amendment briefly examines issue set context,Private
march consortium u semiconductor company call euv llc lead intel include motorola advanced micro device sign cooperative research development agreement crada three department energy laboratory develop commercial application semiconductor manufacturing technology call extreme ultraviolet euv lithography promise euv technology allow semiconductor chip manufacturer make chip compute speed memory capacity,Private
review cause goal railway restructuring country describes advantage disadvantage alternative model rail regulatory regime regulatory framework seven country profile argentina canada france germany japan mexico united kingdom report examines economic performance thee railroad include whether able achieve operating self sufficiency review level government support railroad receive infrastructure operating expense japan european country level government support intercity rail far exceeds level government support united state conclude section review common theme observe foreign experience railway restructuring,Private
several piece legislation introduce th congress specifically address application countervail duty law non market economy include limited h r h r h r h r,Private
wake disclosure related national security agency terrorist surveillance program congressional attention focus issue regard authorization review oversight electronic surveillance program design acquire foreign intelligence information address international terrorism number legislative approach consider th congress three related bill introduce th congress h r,Private
international investment position united state annual measure asset american abroad asset foreigner united state net position difference two sometimes refer measure u international indebtedness although designation strictly correct net international investment position reveal difference total asset american abroad total amount asset foreigner united state asset generate flow capital economy important implication value dollar international exchange market member congress public express concern u net international investment position role foreign investor play u capital market potential large outflow income service payment observer also argue u reliance foreign capital inflow leaf economy vulnerable financial crisis,Private
provide overview u balance payment explanation broader role capital flow u economy explanation country finance trade deficit trade surplus implication congress country large inflow capital abroad,Private
federal budget return persistent deficit fiscal year increase continue increase amount federal government debt sell public sale u treasury issue debt public provide government cash need cover gap income spending treasury bulletin publish quarterly provide data amount federal debt held different category holder category holder include among others depository institution individual pension fund insurance company state local government foreign government international institution report holding federal debt public divide two category domestic private holding foreign international holding hereafter refer foreign holding rest report document growth foreign holding federal debt last year potential consequence change,Private
begin synthesis nonimmigrant category accord purpose visa discus period admission length stay summarizes ground inadmissibility removal well reason termination status describes circumstance nonimmigrants may work united state follow analysis nonimmigrant admission report concludes discussion issue follow two detailed table analyze key admission requirement across nonimmigrant visa type,Private
one measure federal debt may lead confusion explains different measure u government debt discus historical growth debt identifies current owner debt present comparison public debt country examines potential economic risk associate grow federal debt,Private
federal statute limitation old federal crime founder assemble first congress pass first federal criminal law make prosecution law subject specific statute limitation similar provision continue day federal capital offense may prosecute time unless specific arrangement make general five year statute limitation cover federal crime exception general rule like usa patriot act identify longer period particular crime others suspend extend applicable period certain circumstance flight accuse time war,Private
summarizes potential effect usa patriot act electronic privacy security commerce government identifies issue arise,Private
th congress consider h r title export import bank reauthorization act would reauthorize bank charter five year september house measure introduce representative pryce march sent house financial service committee jurisdiction house representative bank measure approve four amendment committee june pass full house unanimously without amendment july senate introduce september senator crapo sent committee banking housing urban affair jurisdiction measure pass senate amendment unanimous consent september date eximbank appropriation continue p l h r amend p l p l december house approve lieu h r reauthorize bank authority september measure sign bush december designate p l h r would make bank operation transparent would require bank take action prepare various report improve bank relative competitive position furthermore h r would authorize office within bank increase total amount loan guarantee go support export socially economically disadvantage small business concern small business concern own woman measure also would provide number change improve competitiveness bank program direct bank study assist new impoverish democracy provide great assistance export involve renewable energy directs bank submit annually congress list u commercial sector product would suffer adverse economic impact due eximbank support project abroad provide side side comparison two bill,Private
discus change coordination funding hiv aid tuberculosis malaria program direct reauthorization act provide background pepfar implementation include result funding fy discus similarity difference h r pass house april h r pass senate july finally detail key outcome legislation enact,Private
series widely publicize incident adulterate chinese seafood import bacteria taint spinach meat poultry produce domestically make food safety issue th congress numerous proposal introduce would alter aspect current u food safety system bill could receive consideration provide overview current system highlight major issue debate improve describes bill,Private
proceeds three part first provide snapshot iraq debt situation follow ouster saddam regime second discus subsequent debt relief negotiation resolution third present three possible implication future debt relief case arise iraq experience willingness international community grant stay enforcement creditor right increase flexibility paris club debt relief decision unwillingness successor regime claim debt odious repudiate,Private
serf resource annual congressional debate foreign policy spending provide context trend analysis past year considers full scope international affair budget budget function foreign policy spending designate within context congressional budget resolution also illustrates spending trend major component make budget function relevant snapshot international spending also examine include foreign aid resource allocate across several sub category trend especially applicable current funding priority confront global health problem increase aid africa,Private
contains overview major procurement agreement united state party include world trade organization wto agreement government procurement procurement chapter north american free trade agreement nafta provision free trade agreement addition report highlight major federal law relate government procurement obligation united state,Private
lay issue likely raise reauthorization debate reason behind possible proposal could offer address concern,Private
present current data estimate ownership united state treasury security major holder federal debt country federal debt represent accumulate balance borrowing federal government finance federal borrowing united state treasury security sell investor treasury security may purchase directly treasury secondary market individual private investor financial institution united state overseas foreign state local government foreign investment federal debt grown recent year prompt question location foreign holder much debt hold,Private
legislation seek apply countervail action nme country introduce th congress legislation include rockefeller h r tancredo h r english h r ryan hunter h r ryan hunter related bill bunning stabenow h r davis english related bill collins bayh baucus introduce august bush administration also take recent step address issue,Private
provide summary statutory history automate entry exit data system recently rename u visitor immigrant status indicator technology u visit program bush administration also discus law affect implementation system provide analysis documentary requirement current law report also discus effort implement program select issue associate development implementation,Private
describes federal program importance specialty crop sector provide recent funding information available,Private
china official assert move aggressively improve food safety system close unsafe plant china late conclude memorandum agreement united state aim improve safety trade food feed product nonetheless member congress continue express sharp criticism china food safety record u effort insure import safety th congress committee side capitol hill held hearing food safety concern generally china situation numerous bill introduce focus import food safety contain provision would apply equally chinese import bill include h r h r h r h r h r h r h r h r provision fda amendment act p l pass september require annual report congress detailed data fda regulate food import also congress clear consolidated appropriation act fy include provision block fsis rule allow certain poultry product import china,Private
united state brace possible repeat incident international terrorism united state may lesson learn experience country suffer prolong onslaught terrorism paper look case judgment make effectiveness different policy measure raise question relate outcome current situation,Private
provide table compare current law congressional rule amend senate,Private
legislative restriction export import bank likely serve primarily advance specific u international economic foreign policy goal likely limited impact bank activity restriction however may well reduce somewhat pool firm seek eximbanks assistance promote u export result assortment restriction policy objective often make difficult determine standard apply ass well bank perform detail major restriction congress place eximbanks activity,Private
provide table graph composition u food aid data restrict u department agriculture data include commodity tonnage value,Private
describes emerge area information operation electronic warfare cyberwar context u national security also suggests related policy issue potential interest congress,Private
th congress new reporting requirement add buy american act p l head federal agency require annually report congress concern procurement non domestic source several bill introduce th congress contain domestic content provision buy american improvement act one would directly amend buy american act bill would make statutory definition american make increase domestic content requirement place limit upon inconsistent public interest use outside united state exception act,Private
indication th congress may visit issue amend current body law comprises foreign aid policy start foreign assistance act present executive branch authority act correlate authority operative appropriation measure p l continued p l fund authority many year annual foreign aid appropriation measure waive requirement fund must authorize appropriate expend understand relation authority cornerstone act appropriation key consideration reform foreign aid legislation,Private
look feature characterize microenterprises u foreign assistance program support microenterprise development examines three issue potential congressional concern funding microenterprise program conflict policy priority challenge face program implementers,Private
focus international medical graduate foreign national many first enter united state receive graduate medical education training cultural exchange visitor j cultural exchange program way enter united state include temporary visa program well permanent immigration avenue family employment base immigration diversity lottery humanitarian relief provision focus enter j program,Private
provide background information analysis u foreign trade service include examination definition example service indicate nature scope review importance service u economy include u foreign trade analysis policy challenge confront united state especially challenge negotiate set international rule trade service challenge resolve dispute trade service trading partner,Private
u aid palestinian fluctuate considerably past three year largely due hamas change role within palestinian authority pa hamas lead pa government year forcible takeover gaza strip june lead creation non hamas government west bank since u dramatically boost aid level bolster pa president mahmoud abbas vi vi hamas fy congress appropriate total million bilateral assistance palestinian large single year appropriation ever palestinian congressional concern among thing u fund might divert palestinian terrorist group much assistance subject legislative restriction fy additional million already appropriate palestinian another million request bush administration expert advise pa stability hinge ever improve security economic development israeli cooperation continuation high level foreign assistance,Private
house pass farm bill would replace rather supplement current federal state cooperative inspection program new program enable meat poultry federally inspect ship across state line long state program adopt standard identical usda along additional change usda require house bill also would enable many plant currently federal inspection apply state inspection continue ship interstate opponent change fear many would seek opt federal system believe could receive lenient oversight state assertion state proponent dismiss conference farm bill becomes law many anticipate stakeholder next turn attention usda implementation detail determine rulemaking process,Private
interim cooperative framework address many congressional concern regard development haiti promotion democratic governance political stability effective transparent use domestic international fund economic development reduction poverty main congressional concern express regard donor conference strategy rate fund disburse effectiveness aid provide donor interim haitian government share responsibility initially slow disbursement fund disbursement increase haiti capacity absorb fund donor concern transparency government spending political instability continue pose obstacle execution icf program,Private
provide overview prior authority cpsc establish consumer product safety standard inspect recall unsafe consumer product discus p l consumer product safety improvement act reform cpsc strengthen enforcement consumer product safety standard,Private
