Text,DocType
arm force united state determines necessary,Public
appropriate order defend national security united,Public
state continue threat pose iraq,Public
nature authority include combat hostile militia,Public
arm proxy act within iraq american force,Public
authorization use military force end defeat,Public
saddam hussein president military authority,Public
japan germany end defeat hirohito hitler,Public
case president authority terminate,Public
respectively president military authority iraq,Public
remains effect president congress terminate,Public
second misunderstand president action,Public
attack iran certainly carry,Public
theater war define congress combatant,Public
command hostile force american troop,Public
president act entirely within legal authority,Public
commander chief within moral responsibility protect,Public
american military diplomatic personnel american citizen,Public
third misunderstand war power act applicable,Public
circumstance war power act governs,Public
circumstance president responds without congressional,Public
authority attack upon united state territory,Public
possession arm force case president already,Public
fourth misunderstand attack soleimani,Public
equivalent president obama attack libya two entirely,Public
different matter attack libya congressional,Public
authorization war power act apply mr obama,Public
military attack response attack united state,Public
entirely unprovoked attack entirely unauthorized,Public
think go forward need get back basic,Public
fundamental understanding constitutional parameter war,Public
american founder make sharp distinction start war,Public
wag war good reason understood,Public
solemn lethal decision entrust one,Public
individual whose authority would greatly augment,Public
decision start war give exclusively congress,Public
assure every voice country heard congress,Public
take stand would obligate put resource,Public
country behind war fight,Public
war begin founder want single commander,Public
chief direct clear unambiguous authority,Public
surer path military disaster squabble prima donna,Public
thus president wage war can not declare,Public
founder debate principle thoroughly,Public
constitutional convention recognize president need,Public
certain residual military power repel attack congress,Public
act believe war power act faithfully defines,Public
circumstance establishes framework contain,Public
war power act give president authority,Public
launch military attack except response direct attack,Public
country limit president authority commander,Public
believe authorization use military force,Public
iraq colossal mistake create dangerous power vacuum,Public
never support full resource united state,Public
rewrite history might,Public
george w bush advocate war bush obama,Public
president trump wag congress adoption,Public
start president wage president trump,Public
inherit mess history judge well handle,Public
certainly instance president clear,Public
unambiguous authority order attack moral imperative,Public
crystal clear debate yesterday,Public
democrat way soleimani would alive today,Public
attack american troop final stage planning,Public
would unfolded would likely today mourn many,Public
president know attack come full,Public
possession opportunity authority stop take,Public
democrat advice do nothing would deeply,Public
culpable loss american shock,Public
perhaps country well even hindsight,Public
course democrat make clear prefer,Public
brings nature resolution house pass,Public
yesterday separation war power legislative,Public
executive branch badly blur recent decade,Public
believe need reestablish constitutional,Public
principle separate declare war wag war,Public
also american tradition go war,Public
must go war utmost obligation put,Public
entire might resource attention nation behind,Public
legitimate debate,Public
house yesterday yesterday deliberately recklessly,Public
undermined position united state government united,Public
state arm force sent iraq shred tradition,Public
perilous moment house refuse stand behind war,Public
authorize refuse protect men woman,Public
place harm way give hostile foreign power major,Public
yet another stain upon honor house one,Public
deplore condemn age come,Public
congressional record online government publishing office www gpo gov,Public
mr mcconnell madam president another matter week,Public
expect senate take war power resolution junior,Public
senator virginia would severely limit u military,Public
operational flexibility defend threat pose iran,Public
strongly oppose colleague effort urge senate,Public
first let discus prompt president successful,Public
decision remove soleimani battlefield last month,Public
limited yet decisive precision strike eliminate terrorist,Public
mastermind responsible american military,Public
reckless act calculate limited,Public
response significant grow threat attack u,Public
personnel iraq embolden adversary year ago soleimani,Public
conclude america paper tiger whose people could kill,Public
relative impunity strike design stop escalation cycle,Public
knew underway restore deterrence reduce risk,Public
yet soleimani record brutality brought end,Public
washington democrat immediately suggest president trump lead,Public
u world war iii middle east mass rejoice,Public
death principal architect iran campaign terror,Public
yet thus far appear soleimani strike indeed,Public
intend effect observe back january appear,Public
restore measure deterrence middle east let screw,Public
well afraid colleague resolution,Public
would successfully sent iran strong signal,Public
strength resolve blunt clumsy war power resolution,Public
china russia watch really good idea,Public
suggest willing let meddling power like iran push u,Public
around self flagellation self limitation would tantamount,Public
year president obama senate democrat like friend,Public
democratic leader frequently say come iran,Public
never take military option table yet,Public
someone else oval office seem want remove,Public
option table l forget fact,Public
conduct ongoing hostility iran one operation,Public
disrupt deter plan attack campaign conflict,Public
discrete limited exercise american power pale,Public
comparison way past president party,Public
routinely use presidential authority utilize military might,Public
without prior consent congress president clinton,Public
distinguish democratic colleague really agree,Public
several party lead presidential candidate,Public
suggest president trump make mistake take sort,Public
executive action eliminate brutal terrorist,Public
colleague really agree prominent voice side,Public
propose exit middle east altogether rather,Public
continue work support local partner defend national,Public
security national interest critical region,Public
try broader debate year,Public
repeatedly sought give democratic colleague,Public
opportunity go record actual big picture strategic,Public
willing support continued military presence syria,Public
iraq believe magically support partner like,Public
kurd without military presence counter,Public
iranian russian influence nowhere found,Public
region believe israel safer region without,Public
ill conceive potshot presidential authority wake,Public
strike succeed use blunt instrument war power,Public
resolution substitute answer broader,Public
oppose colleague resolution tomorrow encourage,Public
congressional record online government publishing office www gpo gov,Public
speaker chair recognizes gentleman oregon mr,Public
mr defazio madam speaker undeniably bad foreign policy,Public
mistake history united state america invasion,Public
iraq base phonied intelligence trumpet dick,Public
cheney scooter libby character bush administration,Public
last week president trump take u verge,Public
even bad foreign policy mistake middle east recklessly,Public
impatiently take u brink war would even,Public
yesterday go call intelligence briefing,Public
offer intelligence regard immediate imminent threat,Public
certainly make case soleimani rotten guy,Public
responsible many many death american others,Public
region recite past history talk,Public
immediate threat intelligence would lead,Public
go say legal justification,Public
authorization use military force invasion iraq,Public
course base phony intelligence regard weapon mass,Public
destruction even extraordinary,Public
last week also president tweet say,Public
compliance war power go tweet threat,Public
war iran go tweet would,Public
order war crime commit war iran,Public
walk back little bit secretary defense,Public
say would follow law trump later say like law,Public
follow law walk back say go,Public
today floor house take rebuke,Public
president action hopefully go,Public
repeal authorization use military force base,Public
hopefully take legislation adopt,Public
amendment defense authorization last summer bipartisan,Public
support say president initiate hostility,Public
congress authority congress authority,Public
declare war war president commander chief,Public
president authority,Public
extraconstitutional attack imminent attack,Public
need fix war power act adopt,Public
illegal action another president richard nixon bombing,Public
two version one follow constitution say,Public
offensive action hostility first come,Public
congress second version say well initiate,Public
report within hour congress authorize,Public
within day withdraw defective weak,Public
reflect congressional duty body,Public
know lot member love dodge issue war,Public
peace toughest vote make essentially,Public
time wink nod well let,Public
president thing hey work take credit,Public
work oh well castigate later,Public
introduce yet bill comprehensively reform,Public
war power act reflect constitutional authority duty,Public
united state congress would say president can not,Public
initiate hostility without first come congress,Public
would define consultation mean mean tweet,Public
congress mean send letter mean,Public
meaningful consultation establishes executive legislative,Public
also include importantly sunset clause,Public
mean thousand year united state guess,Public
repeal authorization use military force,Public
attack whatever iraq thousand year absolutely,Public
finally give congress authority stand go,Public
court president violate constitution war,Public
problem democratic rean president,Public
issue year clinton bosnia bush obviously,Public
number case obama libya thing,Public
also base fake intelligence authorization,Public
let first vote today start point,Public
congressional record online government publishing office www gpo gov,Public
mr cotton madam president next day senate democrat,Public
move discharge war power resolution tie president,Public
hand defend nation iran terrorist mastermind,Public
like qasem soleimani let think get,Public
qasem soleimani blood thousand american hand,Public
hundred thousand innocent soul across middle east,Public
year supreme leader trust,Public
lieutenant iran terror mastermind man responsible,Public
death hundred american soldier iraq afghanistan,Public
supply deadly kind roadside bomb soldier ever face,Public
proxy iranian leader like responsible,Public
bombing embassy place like lebanon kuwait,Public
small part responsible ongoing horror syrian,Public
civil war civil war yemen doubt base,Public
intelligence bloodthirsty past qasem soleimani,Public
baghdad january plot something dangerous,Public
big go target american,Public
thankful qasem soleimani longer walk,Public
earth proud troop execute mission,Public
world safer place america safer nation,Public
people iran give voice man,Public
responsible mow protest year whose,Public
death street celebrate even though,Public
risk mow security force,Public
yet last week democrat able,Public
nothing express regret president decision,Public
eliminate qasem soleimani make mistake war power,Public
resolution future deliver implicit,Public
listen word read resolution,Public
explicit rebuke president order kill qasem,Public
soleimani certainly want prevent president,Public
anything like future introduce,Public
always remind war power,Public
debate time time war power resolution,Public
unconstitutional pass liberal congress,Public
height watergate single president since,Public
acknowledge constitutionality single one include,Public
hear lot constitution day reclaim,Public
authority declare war constrain executive guess,Public
constitutional expert miss federalist paper,Public
authoritative explanation constitution,Public
government house representative people,Public
institution closely tie popular opinion,Public
senate act cool deliberate sense community,Public
single president single president act behalf,Public
federalist would open authoritative,Public
explanation constitution say one president,Public
council two three four state time,Public
found division opinion perspective,Public
temperament executive council would one,Public
president one president act federalist say,Public
energy dispatch yes occasion secrecy,Public
founder think executive council,Public
people imagine would thought commander,Public
chief make operational decision take action,Public
debate war power resolution really many,Public
lawyer armchair ranger dance head pin,Public
think war battle paper resolution war,Public
battle iron resolution think ayatollah,Public
intimidate whereas clause joint resolution,Public
ayatollah intimidate deter scar incinerate,Public
terror mastermind tell,Public
even grant war power resolution constitutional look,Public
actual text resolution make exception iran,Public
develop nuclear weapon ayatollah could hold press,Public
conference tomorrow supreme leader could tweet,Public
go rush nuclear breakout president would come,Public
congress would want take kind action deter,Public
make exception designate terrorist organization,Public
individual like iranian revolutionary guard corp quds,Public
force kill many american continue target,Public
today make exception attack ally middle,Public
sponsor resolution say oh make exception,Public
see get u last couple week,Public
lawyer armchair ranger argue meaning,Public
imminence well say whether attack imminent,Public
look pretty different soldier patrol iraq,Public
comfortable senator sit behind secure wall arm,Public
none mean congress role matter life death,Public
battlefield far fact take,Public
back seat one assert constitutional authority would,Public
remind colleague opportunity insist,Public
barack obama nuclear deal iran submit chamber,Public
treaty one senator vote insist one,Public
guy ninety eight senator perfectly willing create,Public
make phony baloney procedure allow barack obama,Public
submit nuclear arm agreement sworn mortal enemy,Public
chant death america put effect large,Public
majority oppose oppose two third majority,Public
tremendous degree constitutional authority,Public
congress regulate interstate commerce mean sanction,Public
confirm ambassador confirm president cabinet declare,Public
war do time past despite hundred,Public
instance introduce troop importantly way,Public
constrain executive congress think,Public
constrain particular case spending power,Public
particular spending power arm force way,Public
congress congress president control use,Public
arm force president something congress,Public
do lot past vietnam nicaragua,Public
plenty time president act way,Public
much aggressive far reach fashion president trump,Public
couple week ago first taiwan strait crisis granada,Public
libya iran would even say libya,Public
although democratic colleague like send,Public
memory hole since democratic president,Public
would simply say disagree president,Public
decision kill world sadistic bloodthirsty terrorist,Public
mastermind want stop file bill,Public
prohibit use taxpayer fund operation,Public
simple one page help write need,Public
help one page fund use support operation,Public
arm force government iran official,Public
see bill fail last year,Public
politician offer language annual defense,Public
bill try prohibit use fund operation like,Public
saw fail pass defense bill always,Public
overwhelm majority mean vote,Public
know position popular american people,Public
surprisingly american people want elect leader,Public
go act true constitutional,Public
power spare u unconstitutional dangerous war power,Public
resolution simply let people serious,Public
national security troop top necessary,Public
preside officer clerk call roll,Public
senior assistant legislative clerk proceed call roll,Public
mr barrasso madam president ask unanimous consent order,Public
preside officer without objection order,Public
congressional record online government publishing office www gpo gov,Public
war power resolution limit president power act,Public
speaker pro tempore chair recognizes gentleman,Public
mr barr mr speaker rise today strong opposition,Public
dangerous partisan resolution offer democrat colleague,Public
design handcuff president limit constitutional,Public
authority commander chief defend nation iranian,Public
resolution u today needlessly politicizes national,Public
security show democrat put partisan,Public
agenda ahead american people simply like,Public
let clear president trump decisive defensive action,Public
eliminate islamic revolutionary guard corp quds force commander,Public
qasem soleimani reason recent escalation,Public
united state iran president order strike,Public
iran escalation aggression general soleimani,Public
year iran proxy attack u,Public
interest ally since flaw iran nuclear deal,Public
regime receive billion dollar sanction relief,Public
islamic use economic windfall accelerate,Public
support terrorist proxy restart ballistic missile program,Public
violation u n resolution cheat denuclearization,Public
colleague heard quote late senator arthur,Public
chairman senate foreign relation committee must stop,Public
senator vandenberg rean work across aisle,Public
democrat president truman early day cold war right,Public
resolution safeguard constitution attack,Public
constitution attempt divest duly elect president,Public
commander chief power process embolden,Public
fact president trump demonstrate enormous restraint,Public
target action soleimani make vote entirely,Public
unnecessary invasion iran strike,Public
terrorist country legal authority operate,Public
authorization use military force,Public
mr speaker heard many colleague doubt,Public
applicability aumf colleague unconvinced,Public
sufficient authority consider fact even,Public
absence explicit congressional authorization soleimani,Public
strike helpful reminder article ii section,Public
constitution provide president shall commander chief,Public
true constitution give congress sole power,Public
declare war sole power purse either fund defund,Public
military action date back prize case,Public
supreme court long held president may act without congress,Public
recent year justice department office legal counsel,Public
opine constitution authorizes president commander,Public
chief order military action without congressional permission,Public
president determines action would anticipatory self defense,Public
otherwise serf interest united state least,Public
nature scope duration anticipate hostility,Public
specifically olc say president inherent,Public
constitutional authority commander chief broad foreign,Public
policy power duty take care law faithfully,Public
execute empower deplore arm force abroad without,Public
declaration war congress congressional authorization,Public
court generally decline review exercise,Public
war power resolution limit president power act,Public
without congress imposes reporting consultation,Public
requirement president comply,Public
furthermore war power resolution applies deployment,Public
significant body military personnel would apply,Public
finally accord olc arm force otherwise,Public
lawfully station foreign country fire upon defend,Public
doubt engagement hostility would,Public
cover consultation reporting provision war power,Public
course precisely scenario involve,Public
president decisive strike soleimani response attack,Public
thank goodness commander chief allow,Public
another benghazi watch forget framer,Public
constitution specifically reject proposal congress,Public
empower make war imply power president,Public
recognition slow pace inefficiency,Public
legislative proceeding article confederation member,Public
congress special duty jealously guard legislative,Public
prerogative include power declare war provide,Public
check executive branch overreach also must,Public
humility acknowledge congress lack power divest,Public
president commander chief power article ii,Public
congressional record online government publishing office www gpo gov,Public
mr menendez mr president h con re directs president,Public
terminate use u arm force engage hostility,Public
iran unless congress authorize use military force,Public
iran use necessary defend imminent arm,Public
attack h con re agree house representative,Public
january receive senate refer,Public
senate committee foreign relation january,Public
war power resolution pl special procedure,Public
underscore privileged nature concurrent resolution like h,Public
con re section c war power resolution require,Public
privileged concurrent resolution h con re,Public
pass house must refer senate foreign,Public
relation committee shall report committee,Public
together recommendation within fifteen calendar day,Public
day january today january law,Public
concurrent resolution may report favorable,Public
unfavorable recommendation recommendation must,Public
unfortunately appear senate foreign relation committee,Public
majority leadership decide allow calendar day lapse,Public
without take action h con re failure act leaf,Public
understand chairman base inaction primarily,Public
contention concurrent resolution u c c may,Public
privileged us word remove phrase,Public
removal united state arm force engage hostility,Public
rather terminate terminate use united state arm,Public
force engage hostility use h con re,Public
argument appear use remove c,Public
war power resolution eliminates possibility privilege,Public
terminology use regardless functional equivalency,Public
argument suggests removal term art require,Public
approach unjustifiably restrictive treat removal,Public
term art require privilege inconsistent overarch,Public
purpose war power resolution without support either,Public
statutory framework legislative history also undermines senate,Public
purpose war power resolution congress,Public
reconfirm reassert constitutional power undeclared,Public
war availability privileged binding resolution force,Public
president stop use u arm force hostility central,Public
purpose limit privilege single phrase word,Public
inconsistent reassertion congressional power,Public
neither feature statute legislative history,Public
statutory framework war power resolution support,Public
assertion removal removal hostility,Public
term art require exclusive availability,Public
privilege contrary term define law,Public
reference statute military usage,Public
phrase suggest term art,Public
absence statutorily mandate language privilege war,Public
power resolution directly contrast many statute,Public
congress expressly require specific language privilege attach,Public
example contrast war power resolution section f,Public
atomic energy act pl section arm,Public
export control act pl section c counter,Public
america adversary sanction act pl require,Public
specific text privileged resolution provide text,Public
quotation statute clearly evidence law enact,Public
war power resolution congress know require,Public
use unique statutorily mandate language privilege apply,Public
fact war power resolution,Public
demonstrates intent limit privilege use,Public
legislative record war power resolution,Public
support assertion exclusive connection,Public
use removal availability privilege contrary,Public
record indicates remove terminate use,Public
synonymously record replete interchangeable usage,Public
synonymous term consistent cessation use u force,Public
hostility example house report us less,Public
seven term regard include conclude disengage,Public
remove terminate abandon action stop,Public
fact conferee even use terminate describe privileged,Public
resolution envision c clearly demonstrate,Public
term consider functionally equivalent purpose war,Public
power house joint resolution provide use united state,Public
arm force president without declaration war specific,Public
statutory authorization could terminate congress use,Public
concurrent resolution senate amendment provide,Public
termination bill joint resolution h rept,Public
conference report h j re legislative history tandem,Public
statutory construct require term art,Public
demonstrates insistence term privilege,Public
finally strictly limit privilege resolution us,Public
remove inconsistent senate congressional perogatives,Public
purpose war power resolution reassert power,Public
congress undeclared war vindicate executive,Public
branch supporter senate can not use committee floor,Public
procedure bottle resolution consistent purpose,Public
construct war power resolution reading statute,Public
requirement specific terminology requirement exists,Public
unjustifiably restricts senate action limit reassertion,Public
reason state urge chairman immediately take,Public
