Text,DocType
provide analysis immigration enforcement within united state report open definition immigration enforcement discussion statutory authority conduct immigration enforcement overview immigration enforcement related legislation since follow exposition dichotomy interior border enforcement report detail different aspect immigration enforcement united state include detention removal alien smuggle traffic document benefit fraud worksite enforcement inspection port entry patrol border port entry report continue discussion role state local law enforcement enforcement immigration law report present comparative analysis resource devote divergent immigration enforcement activity concludes discussion crosscut immigration enforcement issue related structure department homeland security,Private
focus four immigration policy implication hurricane katrina open discussion employment verification documentary problem arise lose personal identification document follow overview rule noncitizen eligibility federal benefit issue pertain loss life livelihood affect eligibility immigration visa benefit discuss next report close background relief removal option katrina affected alien legislation address policy area discuss relevant section,Private
regional cooperation halt continued overuse scarce water resource casualty long run arab israeli conflict dead sea victim neglect scientist estimate decrease substantially come decade due overexploitation jordan river one possible solution construct canal red sea dead sea pump sea water salt lake generate hydroelectric power use desalination government israel jordan enthusiastic proponent peace canal call international community include united state support multi billion dollar construction however opponent canal claim may environmental harm good suggest dead sea naturally restore allow jordan river flow southward unimpeded water cooperation essential element peace process renewal israeli palestinian negotiation joint project red sea dead sea red dead canal increasingly discuss investigates propose red dead canal analyzes political significance debate surround possible construction,Private
describes nature scope problem traffic person latin america caribbean paper describes u effort deal traffic person region well discus success failure recent country regional anti traffic effort paper concludes raise several issue policy consideration,Private
potential oversight issue congress regard defense transformation include potential dod transformation plan change result robert gate succeed donald rumsfeld secretary defense merit certain element dod transformation plan overall leadership management transformation experiment exercise conduct support transformation measure create culture innovation view necessary support transformation adequacy information provide congress regard transformation related initiative whether administration invoked term transformation purpose rhetorical tool justify various proposal dod,Private
currently federal law recognize sex marriage discus defense marriage act doma p l prohibits federal recognition sex marriage allows individual state refuse recognize marriage perform state discus potential legal challenge doma moreover report summarizes legal principle apply determine validity marriage contract another state survey various approach employ state prevent sex marriage examines house senate resolution introduce previous congress propose constitutional amendment limit federal court jurisdiction hear determine question pertain interpretation doma,Private
provide background information main immigration related border security issue raise result terrorist attack result concern homeland security describes enact legislation th congress well previous congress focus immigration related border security issue report also pose possible immigration related border security issue th congress may consider,Private
imf member country agree quota increase u congress subsequently appropriate additional funding imf october midst asian financial crisis decision engender considerable debate light grow criticism imf lending practice imf request additional increase funding although appropriation new fund imf pending congress exercise oversight authority u policy imf lending practice support congressional oversight imf provide understand organization function role world economy new development require,Private
house rule especially rule x xiii govern authority operation committee subcommittee identifies summarizes rule directive affect committee power authority activity operation,Private
key issue trade promotion authority tpa reauthorization whether recently extent congress allow provision relate labor environment new trade agreement destine fast track consideration focus tpa labor issue trace congressional debate since previous fast track authority expire compare h r bipartisan trade promotion authority act report house way mean committee october h rept h r comprehensive trade negotiate authority act,Private
present side side comparison select legislative proposal consider th congress authorize president use united state arm force iraq would authorize president use u arm force iraq however present different reason authorization condition threshold met congressional consultation requirement reporting requirement,Private
fishery policy guide magnuson stevens fishery conservation management act msfcma originally focus mandate identify fishery encourage underdeveloped fishery establish database socioeconomic variable since time new issue emerge include recognition need identify measure respond overfishing incorporate ecological perspective fishery management increase attention habitat msfcma last reauthorized extensively amend although authorization appropriation msfcma expire end fy act requirement continue force issue congress term condition provision design reauthorize amend act address concern various interest group,Private
examines population family planning activity finance international financial institution ifis base survey activity world bank asian development bank current fund family planning project reference make international framework family planning activity approve international conference population development held cairo table include listing family planning program fund world bank asian development bank,Private
examines u trade remedy program analyzes legislative proposal potential implication,Private
provide outline movement independence flare internal kashmiri political struggle characterize insurgency include description group involve analysis plan recently suggest peact,Private
describes u international step rehabilitate kosovo include cost assessment institutional mechanism assistance program since many believe solution kosovo problem must include economic political development neighbor report also discus aid region,Private
begin overview u nuclear posture cold war summary change adopt past several year describes current u plan policy govern possible use nuclear weapon size structure u nuclear arsenal way arm control agreement might alter nuclear force structure near future report review proposal offer outside analyst alternative administration approach,Private
considers constitutionality federal tort reform legislation product liability medical malpractice reform proposal introduce last several congress tort law present almost exclusively state law rather federal law although note appendix report congress enact number tort reform statute,Private
pakistan primary education system rank among world least effective bush administration congress commission identify issue relevant u interest south asia legislation pass th congress call u support improve expand access education pakistani citizen require secretary state report pakistan education reform strategy u strategy provide relevant assistance review education reform effort pakistan u assistance include discussion current policy,Private
provide detail adam walsh child protection safety act identifies analyzes new legislation introduce th congress discus continue policy issue related sex offender registration community notification,Private
recent month president pierre buyoya government take step strengthen democracy burundi order sanction impose eight african nation lift bring great stability small central african country buyoya step international campaign gain support lift sanction observer seem agree government met condition lift,Private
in v chadha u supreme court struck congress use legislative veto device use half century control certain activity executive branch congress delegate power executive official condition congress could control decision without pas another law legislative control short public law include one house veto two house veto committee veto congress longer relies onehouse two house veto committee subcommittee veto continue part executive legislative accommodation,Private
usa patriot improvement reauthorization act h r report conference committee h rept agree house december raise concern several member senate regard protection civil liberty provide senate additional time consider conference bill th congress enact legislation delay sunset certain provision usa patriot act december february p l approve another extension sunset march p l february usa patriot act additional reauthorizing amendment act introduce senate amends foreign intelligence surveillance act fisa five federal statute provide national security letter nsl authority federal intelligence investigator follow manner grant recipient section order express right petition fisa judge modify quash nondisclosure requirement accompanies order remove requirement recipient section order recipient nsls must provide fbi authorize government authority name attorney consult obtain legal advice concern production order nsl clarifies library service include offering patron access internet subject nsls unless function electronic communication service provider,Private
guide regular appropriation bill congress considers year design supplement information provide house committee appropriation senate subcommittee legislative branch senate committee appropriation summarizes current legislative status bill scope major issue funding level related legislative activity report list key cr staff relevant issue cover related cr product,Private
july house approve usa patriot reauthorization act h r conference committee file report accompany h r h rept separate bill usa patriot act additional reauthorizing amendment act provide civil liberty safeguard include conference report h r sign law p l p l president march,Private
examines accounting system fail provide clear picture enron true condition independent auditor board member unwilling challenge enron management wall street stock analyst bond raters miss trouble ahead rule govern employer stock company pension plan unregulated energy derivative trading core enron business,Private
january navy official announce award vxx helicopter contract lockheed martin corp critic award raise concern effect u defense industrial base u trade whether buy american statute apply question whether competition fair legislation introduce regard issue,Private
western government cite danger kosovo conflict spread nato ally greece turkey justification military intervention kosovo two eastern mediterranean neighbor difficult bilateral relation worsen recent year overarch goal kosovo strikingly similar view nato military campaign differ sharply greece opposes nato approach reason base history culture compete foreign policy goal public opinion sympathy lie serb turkey support nato policy alliance loyalty share history culture attendant sympathy kosovar albanian turkey participate military operation greece greece denies possibility war turkey might result kosovo conflict admits refugee crisis may contain politically destabilize element turkey reject possibility war greece might arise current crisis greek government concerned implication position kosovo u greek relation turkey accept analogy kosovars turkish kurd,Private
provide background management discard computer discus initiative undertaken united state abroad identifies option congress might consider address issue,Private
summarizes rationale contractor responsibility regulation give proponent describes evolution rulemaking process explains major point difference controversy need rule finally report discus action executive branch congress court review impact rule possibly change term,Private
united state engage iraq afghanistan war terrorism congress bush administration create u government sponsor arabic language television station bolster u public diplomacy effort middle east supporter initiative assert receptive audience u television could counterbalance negative perception u policy commonly found arab medium critic maintain arab medium market already saturate western station u public diplomacy fund would effectively use program accord commission report government begin promising initiative television radio broadcasting arab world iran afghanistan effort begin reach large audience broadcasting board governor ask much large resource get administration request million fy figure incorporates operation satellite television network al hurra arabic free one begin broadcasting february information u public diplomacy middle east see cr report rl al jazeera news network opportunity challenge u foreign policy middle east,Private
identifies legislation introduce th congress would directly affect either amateur professional sport united state legislation grouped policy issue,Private
nuclear command control system nccs infrastructure support president combatant commander direct nuclear force discus current role nccs light nuclear posture review npr quadrennial defense review qdr examines current issue surround nccs review modernization initiative summarizes nccs function characteristic review nccs platform,Private
federal white collar employee intend law receive annual pay adjustment locality base comparability payment effective january year section p l federal employee pay comparability act fepca law never implement originally enact annual locality payment pursuant statute reduce year federal white collar employee receive annual pay adjustment locality base comparability payment january president george w bush authorize average pay adjustment executive order issue january although annual adjustment locality payment sometimes refer cost living adjustment neither base change cost living,Private
although department energy doe take step strengthen security counterintelligence practice observer question effectiveness partially bifurcate counterintelligence structure come time observer believe doe national nuclear security administration facility continue major target foreign intelligence service friendly well hostile,Private
provide overview industry federal activity related lng security report describes u lng infrastructure industry safety record security risk industry security initiative since september summarizes recent change federal lng maritime security law related change security role federal agency report discus several policy concern related federal lng security effort public cost marine security uncertainty regard lng terrorism risk security implication building offshore lng facility,Private
wake final report national commission terrorist attack upon united state commonly call commission declare congress oversight intelligence community dysfunctional heighten interest capitol hill strengthen legislative review intelligence community provide general overview core characteristic congressional oversight congress change relationship intelligence community include identification issue make oversight intelligence agency different monitoring federal entity report end several summary observation,Private
part report discus legislative action enhance transition process transition since general consideration presidential transition process part ii contains text major transition statute,Private
interagency coordinative mechanism federal level become prominent prevalent recently office homeland security companion homeland security council visible example include well know entity national security council call drug czar also extend multiplicity nearly anonymous work group task force provide information examination preliminary comparison among federal interagency coordinative device,Private
discus overall composition administration plan allocate billion supplemental provide current status plan propose allocation category agency general purpose appropriation account track congressional debate highlight alternative initiative consideration assess major change direct congress appendix include table describe purpose spending amount appropriation bill congressional decision allocate second billion portion,Private
see international effort bosnia misguide impractical exercise nation building u interest advocate u pullout bosnia leave main burden bosnian peacekeeping european advocate disengagement also favor partition bosnia others believe stability bosnia balkan important stability europe whole view vital u interest many call great international role bosnia attribute shortcoming current policy insufficiently active effort defeat nationalist bosnia flaw dayton accord,Private
provide review discussion historical legal development constitutionally base prerogative president maintain confidentiality document material information reflect presidential decisionmaking deliberation evolve nature scope presidential privilege described discuss recent court decision analyze determine illuminate current interbranch information dispute,Private
april board governor international development association ida approve fourteenth replenishment ida resource world bank concessional lending grant make facility ida fund transfer world bank resource periodic replenishment world bank donor country bush administration pursue achieve number objective ida negotiation include implement result measurement framework increase allocation grant implement performance base allocation increase transparency ida decision make promote opportunity private sector development poorest country discus key aspect ida agreement provide current appropriation information,Private
walker v cheney district court district columbia dismiss suit file comptroller general vice president seek information related composition activity national energy policy development group nepdg declare comptroller general stand maintain action provide overview dispute give rise lawsuit consideration potential ramification district court decision analysis statutory constitutional issue address district court,Private
purpose report describe discus provision provide abortion service military personnel dependent military health care beneficiary military medical facility report describes history provision particular emphasis legislative action finally report discus number proposal modify law well related legislative administrative action,Private
discus campaign result russia december election state duma low legislative chamber implication russia u interest many observer view election setback democratization unprecedented modern russia president vladimir putin place head ticket united russia party party majority duma seat putin widely view gain popular endorsement possible role politics even constitutionally limited second term office end early,Private
mexico held presidential legislative local election july demonstrate mexico evolution toward fully democratic government since opposition president elect first time year,Private
examination federal criminal law implicate internet gamble constitutional question associate application,Private
duty carry member congress understood include representation legislation constituent service education well political electoral activity expectation duty member congress extensive encompass several role could full time job despite acceptance role activity facet member job formal set requirement official explanation role might played member carry duty office absence formal authority many responsibility member congress assume year evolve expectation member constituent,Private
propose regulation announce comment period end december fed reg october address feasibility identify interdict flow illicit internet gamble proceeds five pay system card system money transmission system wire transfer system check collection system automate clearing house ach system suggests except financial institution deal directly illegal internet gamble operator track flow revenue within wire transfer check collection ach system feasible point proposes exempt regulation requirement invite comment offer alternative approach charge illegal internet gamble operator may deal directly within three system participant card money transmission system adopt policy procedure enable identify nature customer business employ customer agreement bar taint transaction establish maintain remedial step deal taint transaction identify introductory remark explain agency reject check list unlawful internet gamble operator approach several bill introduce augment effort include h r internet gamble regulation enforcement act h r internet gamble regulation tax enforcement act h r skill game protection act,Private
examines legal basis investigative oversight follow several prominent example congressional oversight reflect significant milestone establishment breadth reach legislative investigative prerogative vi vi department next ot review ass department contention base policy common law constitutional privilege assert attempt limit congressional access agency information appendix report provide summary inquiry committee successfully obtain document testimony respect internal deliberative process involve open close civil criminal case well programmatic matter part department statutory mission,Private
provide information analysis moldova include political economic situation foreign policy u policy toward moldova,Private
identifies legislation introduce th congress would directly affect amateur professional youth sport united state legislation grouped policy issue,Private
introduce th congress protect employee retiree business bankruptcy act h r proposes number change u bankruptcy code accord sponsor change need remedy inequity bankruptcy process recognize employee retiree unique investment company labor bill contains many proposal change bankruptcy code focus amendment addition u c provide procedure follow debtor possession want reject collective bargaining agreement cba,Private
provide background information matter relevant proposal eliminate epr shift remain preparedness function new directorate refocus fema mission solely consequence management sr initiative make mention effect proposal fema hazard mitigation effort report suggests issue congress might elect investigate provide information authority mission epr review action take since establishment dhs modify directorate function addition report examines homeland security emergency management authority congress assign federal entity dhs present comprehensive picture possible relevant authority administrative issue report concludes option congress might elect consider evaluates merit secretary chertoff sr proposal,Private
international monetary fund imf world trade organization wto approach issue currency manipulation differently imf article agreement prohibit country manipulate currency purpose gain unfair trade advantage imf can not force country change exchange rate policy wto rule subsidy narrow specific seem encompass currency manipulation several option might consider address matter future policymakers deem wise course action,Private
october united state mexico announce mrida initiative multi year proposal billion u assistance mexico central america aim combat drug traffic gang organize crime may house committee foreign affair approve bill h r berman would authorize billion initiative fy fy bush administration request million mexico million central american country fy supplemental appropriation request late june congress appropriate million fy fy supplemental assistance mexico central america fy supplemental appropriation act h r p l act mexico receives million fy supplemental assistance million fy bridge fund supplemental assistance central america haiti dominican republic receive million fy supplemental assistance administration request additional million mexico million central american country mrida initiative fy budget request,Private
provide overview madrasa role muslim world issue related allege link terrorism report also address finding national commission terrorist attack upon united state commission issue relevant second session th congress,Private
national people congress npc people republic china prc less powerful counterpart u congress although china constitution establishes npc high organ state power chinese communist party ccp continue dominate congress throughout npc history recent npc meeting march congress focus economic reform corruption falun gong entry world trade organization exchange u congress npc expand,Private
world telecommunication service trade grow evolve rapidly appear corroborate expectation international agreement liberalize trade basic telecommunication service would greatly increase world trade service agreement auspex world trade organization wto expect benefit highly competitive u telecommunication industry facilitate world economic growth congress nearly always concerned trading partner adhere commitment,Private
